session_ID,Garage_ID,User_ID,User_type,Shared_ID,Start_plugin,Start_plugin_hour,End_plugout,End_plugout_hour,El_kWh,Duration_hours,month_plugin,weekdays_plugin,Plugin_category,Duration_category,Start_plugin_dt,End_plugout_dt,Duration_hours_calc,date
2,AdO3,AdO3-4,Private,Private,21.12.2018 10:24,10,21.12.2018 10:32,10,0.87,0.136666667,Dec,Friday,late morning (9-12),Less than 3 hours,2018-12-21 10:24:00,2018-12-21 10:32:00,0.13333333333333333,2018-12-21
3,AdO3,AdO3-4,Private,Private,21.12.2018 11:33,11,21.12.2018 19:46,19,29.87,8.216388889,Dec,Friday,late morning (9-12),Between 6 and 9  hours,2018-12-21 11:33:00,2018-12-21 19:46:00,8.216666666666667,2018-12-21
4,AdO3,AdO3-2,Private,Private,22.12.2018 16:15,16,23.12.2018 16:40,16,15.56,24.41972222,Dec,Saturday,late afternoon (15-18),More than 18 hours,2018-12-22 16:15:00,2018-12-23 16:40:00,24.416666666666668,2018-12-22
5,AdO3,AdO3-2,Private,Private,24.12.2018 22:03,22,24.12.2018 23:02,23,3.62,0.970555556,Dec,Monday,late evening (21-midnight),Less than 3 hours,2018-12-24 22:03:00,2018-12-24 23:02:00,0.9833333333333333,2018-12-24
6,AdO3,AdO3-2,Private,Private,24.12.2018 23:32,23,25.12.2018 17:37,17,16.14,18.07777778,Dec,Monday,late evening (21-midnight),More than 18 hours,2018-12-24 23:32:00,2018-12-25 17:37:00,18.083333333333332,2018-12-24
7,AdO3,AdO3-2,Private,Private,25.12.2018 18:25,18,26.12.2018 16:08,16,10.33,21.72083333,Dec,Tuesday,early evening (18-21),More than 18 hours,2018-12-25 18:25:00,2018-12-26 16:08:00,21.716666666666665,2018-12-25
8,AdO3,AdO3-4,Private,Private,26.12.2018 10:41,10,26.12.2018 16:52,16,27.66,6.188055556,Dec,Wednesday,late morning (9-12),Between 6 and 9  hours,2018-12-26 10:41:00,2018-12-26 16:52:00,6.183333333333334,2018-12-26
9,AdO3,AdO3-2,Private,Private,26.12.2018 18:46,18,26.12.2018 21:08,21,8.83,2.371111111,Dec,Wednesday,early evening (18-21),Less than 3 hours,2018-12-26 18:46:00,2018-12-26 21:08:00,2.3666666666666667,2018-12-26
10,AdO3,AdO3-2,Private,Private,29.12.2018 16:04,16,29.12.2018 20:55,20,8.58,4.856111111,Dec,Saturday,late afternoon (15-18),Between 3 and 6 hours,2018-12-29 16:04:00,2018-12-29 20:55:00,4.85,2018-12-29
11,AdO3,AdO3-2,Private,Private,29.12.2018 23:48,23,30.12.2018 15:13,15,15.95,15.42833333,Dec,Saturday,late evening (21-midnight),Between 15 and 18 hours,2018-12-29 23:48:00,2018-12-30 15:13:00,15.416666666666666,2018-12-29
12,AdO3,AdO3-2,Private,Private,30.12.2018 16:24,16,30.12.2018 17:23,17,3.64,0.981111111,Dec,Sunday,late afternoon (15-18),Less than 3 hours,2018-12-30 16:24:00,2018-12-30 17:23:00,0.9833333333333333,2018-12-30
13,AdO3,AdO3-2,Private,Private,30.12.2018 22:00,22,31.12.2018 11:28,11,9.79,13.45472222,Dec,Sunday,late evening (21-midnight),Between 12 and 15 hours,2018-12-30 22:00:00,2018-12-31 11:28:00,13.466666666666667,2018-12-30
14,AdO3,AdO3-4,Private,Private,02.01.2019 08:39,8,03.01.2019 09:11,9,28.11,24.53388889,Jan,Wednesday,early morning (6-9),More than 18 hours,2019-01-02 08:39:00,2019-01-03 09:11:00,24.533333333333335,2019-01-02
15,Bl2,Bl2-4,Private,Private,02.01.2019 19:59,19,03.01.2019 00:52,0,14.64,4.879722222,Jan,Wednesday,early evening (18-21),Between 3 and 6 hours,2019-01-02 19:59:00,2019-01-03 00:52:00,4.883333333333334,2019-01-02
16,AdO3,AdO3-2,Private,Private,04.01.2019 15:44,15,05.01.2019 08:06,8,2.0,16.37472222,Jan,Friday,late afternoon (15-18),Between 15 and 18 hours,2019-01-04 15:44:00,2019-01-05 08:06:00,16.366666666666667,2019-01-04
17,AdO3,AdO3-4,Private,Private,05.01.2019 17:10,17,06.01.2019 16:24,16,29.34,23.24166667,Jan,Saturday,late afternoon (15-18),More than 18 hours,2019-01-05 17:10:00,2019-01-06 16:24:00,23.233333333333334,2019-01-05
18,Bl2,Bl2-4,Private,Private,05.01.2019 18:04,18,06.01.2019 17:39,17,14.77,23.58583333,Jan,Saturday,early evening (18-21),More than 18 hours,2019-01-05 18:04:00,2019-01-06 17:39:00,23.583333333333332,2019-01-05
19,AdO1,AdO1-2,Private,Private,05.01.2019 20:06,20,06.01.2019 13:23,13,10.46,17.28666667,Jan,Saturday,early evening (18-21),Between 15 and 18 hours,2019-01-05 20:06:00,2019-01-06 13:23:00,17.283333333333335,2019-01-05
20,AdO1,AdO1-2,Private,Private,06.01.2019 18:02,18,06.01.2019 21:31,21,3.92,3.479722222,Jan,Sunday,early evening (18-21),Between 3 and 6 hours,2019-01-06 18:02:00,2019-01-06 21:31:00,3.4833333333333334,2019-01-06
22,AdO1,AdO1-2,Private,Private,07.01.2019 20:05,20,08.01.2019 10:05,10,6.14,14.0,Jan,Monday,early evening (18-21),Between 12 and 15 hours,2019-01-07 20:05:00,2019-01-08 10:05:00,14.0,2019-01-07
23,AdO1,AdO1-2,Private,Private,08.01.2019 19:28,19,09.01.2019 12:01,12,5.34,16.55194444,Jan,Tuesday,early evening (18-21),Between 15 and 18 hours,2019-01-08 19:28:00,2019-01-09 12:01:00,16.55,2019-01-08
24,Bl2,Bl2-4,Private,Private,09.01.2019 16:46,16,10.01.2019 10:20,10,18.7,17.57194444,Jan,Wednesday,late afternoon (15-18),Between 15 and 18 hours,2019-01-09 16:46:00,2019-01-10 10:20:00,17.566666666666666,2019-01-09
25,AdO1,AdO1-2,Private,Private,09.01.2019 20:59,20,10.01.2019 15:19,15,10.38,18.33777778,Jan,Wednesday,early evening (18-21),More than 18 hours,2019-01-09 20:59:00,2019-01-10 15:19:00,18.333333333333332,2019-01-09
26,Bl2,Bl2-2,Shared,Shared-7,09.01.2019 22:35,22,09.01.2019 23:10,23,1.85,0.585,Jan,Wednesday,late evening (21-midnight),Less than 3 hours,2019-01-09 22:35:00,2019-01-09 23:10:00,0.5833333333333334,2019-01-09
27,AdO3,AdO3-4,Private,Private,09.01.2019 23:53,23,09.01.2019 23:56,23,0.34,0.056666667,Jan,Wednesday,late evening (21-midnight),Less than 3 hours,2019-01-09 23:53:00,2019-01-09 23:56:00,0.05,2019-01-09
28,UT9,Share-12,Shared,Shared-12,10.01.2019 16:30,16,10.01.2019 17:20,17,5.1,0.831944444,Jan,Thursday,late afternoon (15-18),Less than 3 hours,2019-01-10 16:30:00,2019-01-10 17:20:00,0.8333333333333334,2019-01-10
29,AdO1,AdO1-2,Private,Private,10.01.2019 23:32,23,11.01.2019 18:10,18,8.35,18.63138889,Jan,Thursday,late evening (21-midnight),More than 18 hours,2019-01-10 23:32:00,2019-01-11 18:10:00,18.633333333333333,2019-01-10
30,UT9,Share-12,Shared,Shared-12,11.01.2019 15:12,15,11.01.2019 17:07,17,11.7,1.917777778,Jan,Friday,late afternoon (15-18),Less than 3 hours,2019-01-11 15:12:00,2019-01-11 17:07:00,1.9166666666666667,2019-01-11
31,AsO2,Share-4,Shared,Shared-5,11.01.2019 17:13,17,11.01.2019 21:43,21,7.28,4.500833333,Jan,Friday,late afternoon (15-18),Between 3 and 6 hours,2019-01-11 17:13:00,2019-01-11 21:43:00,4.5,2019-01-11
32,Bl2,Share-8,Shared,Shared-6,11.01.2019 18:54,18,12.01.2019 09:47,9,16.79,14.88722222,Jan,Friday,early evening (18-21),Between 12 and 15 hours,2019-01-11 18:54:00,2019-01-12 09:47:00,14.883333333333333,2019-01-11
33,UT9,Share-12,Shared,Shared-12,11.01.2019 20:34,20,11.01.2019 22:56,22,14.63,2.374166667,Jan,Friday,early evening (18-21),Less than 3 hours,2019-01-11 20:34:00,2019-01-11 22:56:00,2.3666666666666667,2019-01-11
34,AsO2,Share-4,Shared,Shared-5,12.01.2019 12:23,12,12.01.2019 13:58,13,5.51,1.576388889,Jan,Saturday,early afternoon (12-15),Less than 3 hours,2019-01-12 12:23:00,2019-01-12 13:58:00,1.5833333333333333,2019-01-12
35,UT9,Share-12,Shared,Shared-12,12.01.2019 13:36,13,12.01.2019 15:32,15,11.99,1.938611111,Jan,Saturday,early afternoon (12-15),Less than 3 hours,2019-01-12 13:36:00,2019-01-12 15:32:00,1.9333333333333333,2019-01-12
36,AsO2,Share-4,Shared,Shared-5,12.01.2019 15:29,15,12.01.2019 18:09,18,6.56,2.669444444,Jan,Saturday,late afternoon (15-18),Less than 3 hours,2019-01-12 15:29:00,2019-01-12 18:09:00,2.6666666666666665,2019-01-12
37,UT9,Share-14,Shared,Shared-12,12.01.2019 15:53,15,12.01.2019 21:21,21,19.0,5.477222222,Jan,Saturday,late afternoon (15-18),Between 3 and 6 hours,2019-01-12 15:53:00,2019-01-12 21:21:00,5.466666666666667,2019-01-12
38,AdO1,AdO1-2,Private,Private,12.01.2019 18:10,18,13.01.2019 18:42,18,6.19,24.53638889,Jan,Saturday,early evening (18-21),More than 18 hours,2019-01-12 18:10:00,2019-01-13 18:42:00,24.533333333333335,2019-01-12
39,AdO3,AdO3-2,Private,Private,12.01.2019 21:43,21,13.01.2019 14:13,14,16.5,16.50194444,Jan,Saturday,late evening (21-midnight),Between 15 and 18 hours,2019-01-12 21:43:00,2019-01-13 14:13:00,16.5,2019-01-12
40,AsO2,Share-4,Shared,Shared-5,13.01.2019 12:27,12,13.01.2019 16:16,16,5.72,3.818055556,Jan,Sunday,early afternoon (12-15),Between 3 and 6 hours,2019-01-13 12:27:00,2019-01-13 16:16:00,3.816666666666667,2019-01-13
41,UT9,Share-12,Shared,Shared-12,13.01.2019 13:30,13,13.01.2019 16:23,16,14.4,2.879722222,Jan,Sunday,early afternoon (12-15),Less than 3 hours,2019-01-13 13:30:00,2019-01-13 16:23:00,2.8833333333333333,2019-01-13
42,Bl2,Share-8,Shared,Shared-6,13.01.2019 15:01,15,13.01.2019 18:20,18,18.48,3.311944444,Jan,Sunday,late afternoon (15-18),Between 3 and 6 hours,2019-01-13 15:01:00,2019-01-13 18:20:00,3.316666666666667,2019-01-13
43,AdO3,AdO3-2,Private,Private,13.01.2019 17:07,17,14.01.2019 12:53,12,13.88,19.77722222,Jan,Sunday,late afternoon (15-18),More than 18 hours,2019-01-13 17:07:00,2019-01-14 12:53:00,19.766666666666666,2019-01-13
44,Bl2,Bl2-4,Private,Private,14.01.2019 18:53,18,15.01.2019 10:06,10,14.21,15.20972222,Jan,Monday,early evening (18-21),Between 15 and 18 hours,2019-01-14 18:53:00,2019-01-15 10:06:00,15.216666666666667,2019-01-14
45,UT9,Share-12,Shared,Shared-12,14.01.2019 19:52,19,15.01.2019 06:37,6,27.24,10.74611111,Jan,Monday,early evening (18-21),Between 9 and 12 hours,2019-01-14 19:52:00,2019-01-15 06:37:00,10.75,2019-01-14
46,AdO1,AdO1-2,Private,Private,14.01.2019 21:05,21,15.01.2019 13:33,13,4.09,16.47166667,Jan,Monday,late evening (21-midnight),Between 15 and 18 hours,2019-01-14 21:05:00,2019-01-15 13:33:00,16.466666666666665,2019-01-14
47,AdO1,AdO1-2,Private,Private,15.01.2019 15:28,15,15.01.2019 17:12,17,3.97,1.730555556,Jan,Tuesday,late afternoon (15-18),Less than 3 hours,2019-01-15 15:28:00,2019-01-15 17:12:00,1.7333333333333334,2019-01-15
48,AdO3,AdO3-4,Private,Private,15.01.2019 18:39,18,16.01.2019 08:24,8,15.47,13.74833333,Jan,Tuesday,early evening (18-21),Between 12 and 15 hours,2019-01-15 18:39:00,2019-01-16 08:24:00,13.75,2019-01-15
49,AdO1,AdO1-2,Private,Private,15.01.2019 19:57,19,16.01.2019 10:15,10,5.29,14.30305556,Jan,Tuesday,early evening (18-21),Between 12 and 15 hours,2019-01-15 19:57:00,2019-01-16 10:15:00,14.3,2019-01-15
50,Bl2,Bl2-2,Shared,Shared-6,15.01.2019 22:41,22,16.01.2019 07:52,7,14.61,9.182222222,Jan,Tuesday,late evening (21-midnight),Between 9 and 12 hours,2019-01-15 22:41:00,2019-01-16 07:52:00,9.183333333333334,2019-01-15
51,Bl2,Share-8,Shared,Shared-7,15.01.2019 23:32,23,16.01.2019 11:08,11,22.31,11.5975,Jan,Tuesday,late evening (21-midnight),Between 9 and 12 hours,2019-01-15 23:32:00,2019-01-16 11:08:00,11.6,2019-01-15
52,AdO1,AdO1-2,Private,Private,16.01.2019 13:44,13,17.01.2019 17:37,17,6.2,27.87416667,Jan,Wednesday,early afternoon (12-15),More than 18 hours,2019-01-16 13:44:00,2019-01-17 17:37:00,27.883333333333333,2019-01-16
53,UT9,Share-14,Shared,Shared-12,17.01.2019 11:32,11,17.01.2019 12:18,12,2.83,0.773055556,Jan,Thursday,late morning (9-12),Less than 3 hours,2019-01-17 11:32:00,2019-01-17 12:18:00,0.7666666666666667,2019-01-17
54,UT9,Share-14,Shared,Shared-12,17.01.2019 12:51,12,17.01.2019 13:51,13,3.67,1.006666667,Jan,Thursday,early afternoon (12-15),Less than 3 hours,2019-01-17 12:51:00,2019-01-17 13:51:00,1.0,2019-01-17
55,AdO3,AdO3-4,Private,Private,17.01.2019 17:39,17,18.01.2019 15:16,15,30.2,21.61916667,Jan,Thursday,late afternoon (15-18),More than 18 hours,2019-01-17 17:39:00,2019-01-18 15:16:00,21.616666666666667,2019-01-17
56,AdO1,AdO1-2,Private,Private,17.01.2019 18:56,18,18.01.2019 18:20,18,9.25,23.40583333,Jan,Thursday,early evening (18-21),More than 18 hours,2019-01-17 18:56:00,2019-01-18 18:20:00,23.4,2019-01-17
57,Bl2,Share-8,Shared,Shared-6,17.01.2019 22:16,22,18.01.2019 10:16,10,25.62,12.01138889,Jan,Thursday,late evening (21-midnight),Between 12 and 15 hours,2019-01-17 22:16:00,2019-01-18 10:16:00,12.0,2019-01-17
58,UT9,Share-14,Shared,Shared-12,17.01.2019 22:48,22,18.01.2019 05:38,5,18.29,6.841944444,Jan,Thursday,late evening (21-midnight),Between 6 and 9  hours,2019-01-17 22:48:00,2019-01-18 05:38:00,6.833333333333333,2019-01-17
59,AsO2,Share-6,Shared,Shared-5,18.01.2019 02:00,2,18.01.2019 02:08,2,0.75,0.1325,Jan,Friday,early night (midnight-3),Less than 3 hours,2019-01-18 02:00:00,2019-01-18 02:08:00,0.13333333333333333,2019-01-18
60,UT9,Share-6,Shared,Shared-11,18.01.2019 02:12,2,18.01.2019 02:30,2,1.45,0.309722222,Jan,Friday,early night (midnight-3),Less than 3 hours,2019-01-18 02:12:00,2019-01-18 02:30:00,0.3,2019-01-18
61,Bl2,Bl2-4,Private,Private,18.01.2019 15:39,15,19.01.2019 10:47,10,20.53,19.12833333,Jan,Friday,late afternoon (15-18),More than 18 hours,2019-01-18 15:39:00,2019-01-19 10:47:00,19.133333333333333,2019-01-18
62,UT9,Share-6,Shared,Shared-12,18.01.2019 22:33,22,19.01.2019 01:18,1,16.71,2.735,Jan,Friday,late evening (21-midnight),Less than 3 hours,2019-01-18 22:33:00,2019-01-19 01:18:00,2.75,2019-01-18
63,Bl2,Share-8,Shared,Shared-6,18.01.2019 23:35,23,19.01.2019 04:00,4,13.06,4.411666667,Jan,Friday,late evening (21-midnight),Between 3 and 6 hours,2019-01-18 23:35:00,2019-01-19 04:00:00,4.416666666666667,2019-01-18
64,AsO2,Share-4,Shared,Shared-5,19.01.2019 13:07,13,19.01.2019 16:35,16,8.79,3.454722222,Jan,Saturday,early afternoon (12-15),Between 3 and 6 hours,2019-01-19 13:07:00,2019-01-19 16:35:00,3.466666666666667,2019-01-19
65,UT9,Share-12,Shared,Shared-12,19.01.2019 14:16,14,19.01.2019 19:47,19,29.73,5.527222222,Jan,Saturday,early afternoon (12-15),Between 3 and 6 hours,2019-01-19 14:16:00,2019-01-19 19:47:00,5.516666666666667,2019-01-19
66,UT9,Share-6,Shared,Shared-12,19.01.2019 22:27,22,20.01.2019 00:57,0,14.84,2.502777778,Jan,Saturday,late evening (21-midnight),Less than 3 hours,2019-01-19 22:27:00,2019-01-20 00:57:00,2.5,2019-01-19
67,Bl2,Bl2-2,Shared,Shared-6,20.01.2019 21:21,21,21.01.2019 10:14,10,19.43,12.88361111,Jan,Sunday,late evening (21-midnight),Between 12 and 15 hours,2019-01-20 21:21:00,2019-01-21 10:14:00,12.883333333333333,2019-01-20
68,UT9,Share-12,Shared,Shared-12,21.01.2019 15:57,15,21.01.2019 18:40,18,16.65,2.709166667,Jan,Monday,late afternoon (15-18),Less than 3 hours,2019-01-21 15:57:00,2019-01-21 18:40:00,2.716666666666667,2019-01-21
69,AdO1,AdO1-2,Private,Private,21.01.2019 16:27,16,29.01.2019 11:31,11,7.99,187.0569444,Jan,Monday,late afternoon (15-18),More than 18 hours,2019-01-21 16:27:00,2019-01-29 11:31:00,187.06666666666666,2019-01-21
70,UT9,Share-12,Shared,Shared-12,22.01.2019 14:36,14,22.01.2019 18:39,18,24.36,4.046388889,Jan,Tuesday,early afternoon (12-15),Between 3 and 6 hours,2019-01-22 14:36:00,2019-01-22 18:39:00,4.05,2019-01-22
71,Bl2,Share-8,Shared,Shared-6,22.01.2019 18:52,18,22.01.2019 23:13,23,18.47,4.346111111,Jan,Tuesday,early evening (18-21),Between 3 and 6 hours,2019-01-22 18:52:00,2019-01-22 23:13:00,4.35,2019-01-22
72,UT9,Share-14,Shared,Shared-12,23.01.2019 11:48,11,23.01.2019 12:48,12,2.92,0.9975,Jan,Wednesday,late morning (9-12),Less than 3 hours,2019-01-23 11:48:00,2019-01-23 12:48:00,1.0,2019-01-23
73,UT9,Share-12,Shared,Shared-12,23.01.2019 15:57,15,23.01.2019 20:50,20,20.48,4.878611111,Jan,Wednesday,late afternoon (15-18),Between 3 and 6 hours,2019-01-23 15:57:00,2019-01-23 20:50:00,4.883333333333334,2019-01-23
74,Bl2,Bl2-4,Private,Private,23.01.2019 19:00,19,24.01.2019 05:17,5,15.66,10.28333333,Jan,Wednesday,early evening (18-21),Between 9 and 12 hours,2019-01-23 19:00:00,2019-01-24 05:17:00,10.283333333333333,2019-01-23
75,UT9,Share-14,Shared,Shared-12,23.01.2019 21:43,21,24.01.2019 04:10,4,19.25,6.458055556,Jan,Wednesday,late evening (21-midnight),Between 6 and 9  hours,2019-01-23 21:43:00,2019-01-24 04:10:00,6.45,2019-01-23
76,AsO2,Share-4,Shared,Shared-5,24.01.2019 16:33,16,25.01.2019 00:14,0,6.9,7.694166667,Jan,Thursday,late afternoon (15-18),Between 6 and 9  hours,2019-01-24 16:33:00,2019-01-25 00:14:00,7.683333333333334,2019-01-24
77,Bl2,Share-8,Shared,Shared-6,24.01.2019 22:15,22,25.01.2019 07:29,7,18.47,9.231666667,Jan,Thursday,late evening (21-midnight),Between 9 and 12 hours,2019-01-24 22:15:00,2019-01-25 07:29:00,9.233333333333333,2019-01-24
78,Bl2,Bl2-2,Shared,Shared-6,25.01.2019 13:29,13,25.01.2019 14:47,14,4.39,1.302777778,Jan,Friday,early afternoon (12-15),Less than 3 hours,2019-01-25 13:29:00,2019-01-25 14:47:00,1.3,2019-01-25
79,Bl2,Bl2-1,Private,Private,25.01.2019 15:39,15,25.01.2019 15:52,15,0.71,0.204444444,Jan,Friday,late afternoon (15-18),Less than 3 hours,2019-01-25 15:39:00,2019-01-25 15:52:00,0.21666666666666667,2019-01-25
81,Bl2,Bl2-1,Private,Private,25.01.2019 15:52,15,25.01.2019 16:01,16,0.47,0.143611111,Jan,Friday,late afternoon (15-18),Less than 3 hours,2019-01-25 15:52:00,2019-01-25 16:01:00,0.15,2019-01-25
83,Bl2,Bl2-1,Private,Private,25.01.2019 16:09,16,25.01.2019 16:50,16,2.39,0.669722222,Jan,Friday,late afternoon (15-18),Less than 3 hours,2019-01-25 16:09:00,2019-01-25 16:50:00,0.6833333333333333,2019-01-25
84,AsO2,Share-4,Shared,Shared-5,25.01.2019 16:47,16,25.01.2019 21:34,21,7.31,4.7925,Jan,Friday,late afternoon (15-18),Between 3 and 6 hours,2019-01-25 16:47:00,2019-01-25 21:34:00,4.783333333333333,2019-01-25
85,Bl2,Bl2-1,Private,Private,25.01.2019 16:50,16,25.01.2019 16:53,16,0.09,0.056666667,Jan,Friday,late afternoon (15-18),Less than 3 hours,2019-01-25 16:50:00,2019-01-25 16:53:00,0.05,2019-01-25
86,Bl2,Bl2-1,Private,Private,25.01.2019 16:54,16,25.01.2019 17:36,17,2.51,0.7025,Jan,Friday,late afternoon (15-18),Less than 3 hours,2019-01-25 16:54:00,2019-01-25 17:36:00,0.7,2019-01-25
87,UT9,Share-12,Shared,Shared-12,25.01.2019 18:01,18,26.01.2019 10:34,10,27.02,16.545,Jan,Friday,early evening (18-21),Between 15 and 18 hours,2019-01-25 18:01:00,2019-01-26 10:34:00,16.55,2019-01-25
88,Bl2,Bl2-1,Private,Private,25.01.2019 19:40,19,26.01.2019 12:58,12,10.6,17.31055556,Jan,Friday,early evening (18-21),Between 15 and 18 hours,2019-01-25 19:40:00,2019-01-26 12:58:00,17.3,2019-01-25
89,Bl2,Bl2-2,Shared,Shared-6,25.01.2019 20:20,20,26.01.2019 00:22,0,14.63,4.032777778,Jan,Friday,early evening (18-21),Between 3 and 6 hours,2019-01-25 20:20:00,2019-01-26 00:22:00,4.033333333333333,2019-01-25
90,AsO2,Share-4,Shared,Shared-5,26.01.2019 09:28,9,26.01.2019 10:57,10,2.59,1.481111111,Jan,Saturday,late morning (9-12),Less than 3 hours,2019-01-26 09:28:00,2019-01-26 10:57:00,1.4833333333333334,2019-01-26
91,Bl2,Bl2-2,Shared,Shared-6,26.01.2019 15:27,15,27.01.2019 09:57,9,20.57,18.48861111,Jan,Saturday,late afternoon (15-18),More than 18 hours,2019-01-26 15:27:00,2019-01-27 09:57:00,18.5,2019-01-26
92,Bl2,Bl2-1,Private,Private,26.01.2019 17:34,17,26.01.2019 17:58,17,1.4,0.393055556,Jan,Saturday,late afternoon (15-18),Less than 3 hours,2019-01-26 17:34:00,2019-01-26 17:58:00,0.4,2019-01-26
93,Bl2,Bl2-1,Private,Private,26.01.2019 18:47,18,27.01.2019 04:00,4,15.46,9.226111111,Jan,Saturday,early evening (18-21),Between 9 and 12 hours,2019-01-26 18:47:00,2019-01-27 04:00:00,9.216666666666667,2019-01-26
94,Bl2,Share-8,Shared,Shared-7,26.01.2019 19:02,19,27.01.2019 08:35,8,19.11,13.55638889,Jan,Saturday,early evening (18-21),Between 12 and 15 hours,2019-01-26 19:02:00,2019-01-27 08:35:00,13.55,2019-01-26
95,Bl2,Bl2-1,Private,Private,27.01.2019 04:00,4,27.01.2019 09:53,9,0.94,5.880833333,Jan,Sunday,late night (3-6),Between 3 and 6 hours,2019-01-27 04:00:00,2019-01-27 09:53:00,5.883333333333334,2019-01-27
96,UT9,Share-12,Shared,Shared-12,27.01.2019 14:08,14,27.01.2019 18:11,18,24.05,4.054166667,Jan,Sunday,early afternoon (12-15),Between 3 and 6 hours,2019-01-27 14:08:00,2019-01-27 18:11:00,4.05,2019-01-27
97,UT9,Share-6,Shared,Shared-11,27.01.2019 17:53,17,27.01.2019 21:53,21,22.78,4.003611111,Jan,Sunday,late afternoon (15-18),Between 3 and 6 hours,2019-01-27 17:53:00,2019-01-27 21:53:00,4.0,2019-01-27
98,UT9,Share-12,Shared,Shared-12,27.01.2019 18:11,18,27.01.2019 19:47,19,1.55,1.5975,Jan,Sunday,early evening (18-21),Less than 3 hours,2019-01-27 18:11:00,2019-01-27 19:47:00,1.6,2019-01-27
99,Bl2,Bl2-2,Shared,Shared-6,27.01.2019 19:33,19,28.01.2019 07:24,7,16.49,11.85944444,Jan,Sunday,early evening (18-21),Between 9 and 12 hours,2019-01-27 19:33:00,2019-01-28 07:24:00,11.85,2019-01-27
100,Bl2,Share-8,Shared,Shared-7,27.01.2019 23:45,23,28.01.2019 09:55,9,15.59,10.17111111,Jan,Sunday,late evening (21-midnight),Between 9 and 12 hours,2019-01-27 23:45:00,2019-01-28 09:55:00,10.166666666666666,2019-01-27
101,UT9,Share-14,Shared,Shared-12,28.01.2019 11:00,11,28.01.2019 13:54,13,10.64,2.9025,Jan,Monday,late morning (9-12),Less than 3 hours,2019-01-28 11:00:00,2019-01-28 13:54:00,2.9,2019-01-28
102,Bl2,Bl2-2,Private,Private,28.01.2019 18:37,18,29.01.2019 11:32,11,6.99,16.91333333,Jan,Monday,early evening (18-21),Between 15 and 18 hours,2019-01-28 18:37:00,2019-01-29 11:32:00,16.916666666666668,2019-01-28
103,Bl2,Bl2-1,Private,Private,28.01.2019 19:18,19,28.01.2019 22:38,22,9.06,3.336388889,Jan,Monday,early evening (18-21),Between 3 and 6 hours,2019-01-28 19:18:00,2019-01-28 22:38:00,3.3333333333333335,2019-01-28
104,Bl2,Bl2-4,Private,Private,29.01.2019 17:25,17,29.01.2019 20:27,20,19.88,3.046111111,Jan,Tuesday,late afternoon (15-18),Between 3 and 6 hours,2019-01-29 17:25:00,2019-01-29 20:27:00,3.033333333333333,2019-01-29
105,Bl2,Bl2-1,Private,Private,29.01.2019 19:25,19,29.01.2019 21:06,21,5.86,1.672777778,Jan,Tuesday,early evening (18-21),Less than 3 hours,2019-01-29 19:25:00,2019-01-29 21:06:00,1.6833333333333333,2019-01-29
106,Bl2,Bl2-4,Private,Private,29.01.2019 20:27,20,30.01.2019 08:56,8,1.14,12.47277778,Jan,Tuesday,early evening (18-21),Between 12 and 15 hours,2019-01-29 20:27:00,2019-01-30 08:56:00,12.483333333333333,2019-01-29
107,Bl2,Bl2-2,Private,Private,30.01.2019 00:13,0,30.01.2019 01:00,1,2.73,0.789444444,Jan,Wednesday,early night (midnight-3),Less than 3 hours,2019-01-30 00:13:00,2019-01-30 01:00:00,0.7833333333333333,2019-01-30
108,Bl2,Bl2-1,Private,Private,30.01.2019 07:47,7,30.01.2019 11:44,11,11.0,3.945277778,Jan,Wednesday,early morning (6-9),Between 3 and 6 hours,2019-01-30 07:47:00,2019-01-30 11:44:00,3.95,2019-01-30
109,UT9,Share-14,Shared,Shared-12,30.01.2019 09:03,9,30.01.2019 13:17,13,15.47,4.231666667,Jan,Wednesday,late morning (9-12),Between 3 and 6 hours,2019-01-30 09:03:00,2019-01-30 13:17:00,4.233333333333333,2019-01-30
110,Bl2,Bl2-1,Private,Private,30.01.2019 16:47,16,30.01.2019 20:19,20,6.9,3.538888889,Jan,Wednesday,late afternoon (15-18),Between 3 and 6 hours,2019-01-30 16:47:00,2019-01-30 20:19:00,3.533333333333333,2019-01-30
111,UT9,Share-12,Shared,Shared-12,30.01.2019 19:06,19,31.01.2019 06:30,6,31.06,11.39638889,Jan,Wednesday,early evening (18-21),Between 9 and 12 hours,2019-01-30 19:06:00,2019-01-31 06:30:00,11.4,2019-01-30
112,UT9,Share-14,Shared,Shared-12,31.01.2019 09:23,9,31.01.2019 11:47,11,8.82,2.388055556,Jan,Thursday,late morning (9-12),Less than 3 hours,2019-01-31 09:23:00,2019-01-31 11:47:00,2.4,2019-01-31
113,AsO2,Share-4,Shared,Shared-5,31.01.2019 13:04,13,31.01.2019 15:03,15,3.24,1.971111111,Jan,Thursday,early afternoon (12-15),Less than 3 hours,2019-01-31 13:04:00,2019-01-31 15:03:00,1.9833333333333334,2019-01-31
114,UT9,Share-6,Shared,Shared-12,31.01.2019 13:49,13,31.01.2019 17:34,17,20.18,3.74,Jan,Thursday,early afternoon (12-15),Between 3 and 6 hours,2019-01-31 13:49:00,2019-01-31 17:34:00,3.75,2019-01-31
115,Bl2,Bl2-2,Private,Private,31.01.2019 15:20,15,31.01.2019 18:03,18,9.52,2.718055556,Jan,Thursday,late afternoon (15-18),Less than 3 hours,2019-01-31 15:20:00,2019-01-31 18:03:00,2.716666666666667,2019-01-31
116,UT9,Share-14,Shared,Shared-11,31.01.2019 15:41,15,31.01.2019 17:53,17,8.05,2.191666667,Jan,Thursday,late afternoon (15-18),Less than 3 hours,2019-01-31 15:41:00,2019-01-31 17:53:00,2.2,2019-01-31
117,Bl2,Share-8,Shared,Shared-6,31.01.2019 16:25,16,31.01.2019 18:27,18,12.37,2.030277778,Jan,Thursday,late afternoon (15-18),Less than 3 hours,2019-01-31 16:25:00,2019-01-31 18:27:00,2.033333333333333,2019-01-31
118,AsO2,AsO2-1,Private,Private,31.01.2019 18:34,18,01.02.2019 07:04,7,7.2,12.50194444,Jan,Thursday,early evening (18-21),Between 12 and 15 hours,2019-01-31 18:34:00,2019-02-01 07:04:00,12.5,2019-01-31
119,UT9,Share-14,Shared,Shared-12,31.01.2019 20:14,20,01.02.2019 07:33,7,18.81,11.31111111,Jan,Thursday,early evening (18-21),Between 9 and 12 hours,2019-01-31 20:14:00,2019-02-01 07:33:00,11.316666666666666,2019-01-31
120,Bl2,Bl2-2,Private,Private,31.01.2019 20:34,20,31.01.2019 21:23,21,2.51,0.813055556,Jan,Thursday,early evening (18-21),Less than 3 hours,2019-01-31 20:34:00,2019-01-31 21:23:00,0.8166666666666667,2019-01-31
121,Bl2,Bl2-1,Private,Private,01.02.2019 15:45,15,01.02.2019 18:06,18,8.43,2.354444444,Feb,Friday,late afternoon (15-18),Less than 3 hours,2019-02-01 15:45:00,2019-02-01 18:06:00,2.35,2019-02-01
122,UT9,Share-14,Shared,Shared-12,01.02.2019 16:20,16,01.02.2019 20:00,20,13.48,3.663611111,Feb,Friday,late afternoon (15-18),Between 3 and 6 hours,2019-02-01 16:20:00,2019-02-01 20:00:00,3.6666666666666665,2019-02-01
123,AsO2,Share-4,Shared,Shared-5,01.02.2019 16:38,16,01.02.2019 17:29,17,2.7,0.850277778,Feb,Friday,late afternoon (15-18),Less than 3 hours,2019-02-01 16:38:00,2019-02-01 17:29:00,0.85,2019-02-01
124,Bl2,Bl2-2,Shared,Shared-6,01.02.2019 18:09,18,01.02.2019 19:45,19,5.65,1.584444444,Feb,Friday,early evening (18-21),Less than 3 hours,2019-02-01 18:09:00,2019-02-01 19:45:00,1.6,2019-02-01
125,Bl2,Bl2-1,Private,Private,01.02.2019 18:41,18,02.02.2019 11:49,11,7.95,17.13111111,Feb,Friday,early evening (18-21),Between 15 and 18 hours,2019-02-01 18:41:00,2019-02-02 11:49:00,17.133333333333333,2019-02-01
126,AdO3,AdO3-2,Private,Private,01.02.2019 22:22,22,02.02.2019 12:56,12,11.78,14.57277778,Feb,Friday,late evening (21-midnight),Between 12 and 15 hours,2019-02-01 22:22:00,2019-02-02 12:56:00,14.566666666666666,2019-02-01
127,AsO2,Share-4,Shared,Shared-5,02.02.2019 09:03,9,02.02.2019 14:26,14,6.1,5.377222222,Feb,Saturday,late morning (9-12),Between 3 and 6 hours,2019-02-02 09:03:00,2019-02-02 14:26:00,5.383333333333334,2019-02-02
128,UT9,Share-12,Shared,Shared-12,02.02.2019 17:47,17,03.02.2019 08:31,8,26.88,14.73277778,Feb,Saturday,late afternoon (15-18),Between 12 and 15 hours,2019-02-02 17:47:00,2019-02-03 08:31:00,14.733333333333333,2019-02-02
129,AsO2,AsO2-1,Private,Private,02.02.2019 18:12,18,02.02.2019 21:45,21,12.68,3.548055556,Feb,Saturday,early evening (18-21),Between 3 and 6 hours,2019-02-02 18:12:00,2019-02-02 21:45:00,3.55,2019-02-02
130,Bl2,Share-8,Shared,Shared-6,03.02.2019 00:41,0,03.02.2019 09:52,9,20.36,9.1925,Feb,Sunday,early night (midnight-3),Between 9 and 12 hours,2019-02-03 00:41:00,2019-02-03 09:52:00,9.183333333333334,2019-02-03
131,Bl2,Bl2-2,Shared,Shared-6,03.02.2019 16:58,16,03.02.2019 18:46,18,6.5,1.8025,Feb,Sunday,late afternoon (15-18),Less than 3 hours,2019-02-03 16:58:00,2019-02-03 18:46:00,1.8,2019-02-03
132,Bl2,Bl2-2,Private,Private,03.02.2019 19:13,19,03.02.2019 20:28,20,4.44,1.243888889,Feb,Sunday,early evening (18-21),Less than 3 hours,2019-02-03 19:13:00,2019-02-03 20:28:00,1.25,2019-02-03
133,Bl2,Bl2-2,Private,Private,03.02.2019 21:25,21,04.02.2019 08:12,8,8.63,10.79305556,Feb,Sunday,late evening (21-midnight),Between 9 and 12 hours,2019-02-03 21:25:00,2019-02-04 08:12:00,10.783333333333333,2019-02-03
135,Bl2,Bl2-5,Private,Private,04.02.2019 17:37,17,04.02.2019 20:18,20,9.62,2.690555556,Feb,Monday,late afternoon (15-18),Less than 3 hours,2019-02-04 17:37:00,2019-02-04 20:18:00,2.683333333333333,2019-02-04
137,AsO2,Share-4,Shared,Shared-5,04.02.2019 18:30,18,04.02.2019 20:03,20,5.33,1.556111111,Feb,Monday,early evening (18-21),Less than 3 hours,2019-02-04 18:30:00,2019-02-04 20:03:00,1.55,2019-02-04
139,UT9,Share-14,Shared,Shared-12,04.02.2019 22:35,22,05.02.2019 05:17,5,17.91,6.695833333,Feb,Monday,late evening (21-midnight),Between 6 and 9  hours,2019-02-04 22:35:00,2019-02-05 05:17:00,6.7,2019-02-04
140,AsO2,Share-4,Shared,Shared-5,05.02.2019 17:05,17,05.02.2019 18:15,18,3.94,1.159444444,Feb,Tuesday,late afternoon (15-18),Less than 3 hours,2019-02-05 17:05:00,2019-02-05 18:15:00,1.1666666666666667,2019-02-05
141,AsO2,AsO2-1,Private,Private,05.02.2019 17:21,17,06.02.2019 07:26,7,16.56,14.08527778,Feb,Tuesday,late afternoon (15-18),Between 12 and 15 hours,2019-02-05 17:21:00,2019-02-06 07:26:00,14.083333333333334,2019-02-05
142,AsO2,AsO2-1,Private,Private,06.02.2019 19:47,19,07.02.2019 06:28,6,14.65,10.67444444,Feb,Wednesday,early evening (18-21),Between 9 and 12 hours,2019-02-06 19:47:00,2019-02-07 06:28:00,10.683333333333334,2019-02-06
143,UT9,Share-12,Shared,Shared-12,07.02.2019 11:30,11,07.02.2019 16:19,16,28.39,4.821944444,Feb,Thursday,late morning (9-12),Between 3 and 6 hours,2019-02-07 11:30:00,2019-02-07 16:19:00,4.816666666666666,2019-02-07
144,AsO2,Share-4,Shared,Shared-5,08.02.2019 16:58,16,08.02.2019 19:49,19,0.27,2.848055556,Feb,Friday,late afternoon (15-18),Less than 3 hours,2019-02-08 16:58:00,2019-02-08 19:49:00,2.85,2019-02-08
145,AsO2,Share-4,Shared,Shared-5,08.02.2019 21:31,21,09.02.2019 09:55,9,6.88,12.40555556,Feb,Friday,late evening (21-midnight),Between 12 and 15 hours,2019-02-08 21:31:00,2019-02-09 09:55:00,12.4,2019-02-08
146,AsO2,Share-4,Shared,Shared-5,09.02.2019 14:54,14,10.02.2019 09:28,9,6.44,18.56527778,Feb,Saturday,early afternoon (12-15),More than 18 hours,2019-02-09 14:54:00,2019-02-10 09:28:00,18.566666666666666,2019-02-09
147,UT9,Share-12,Shared,Shared-12,09.02.2019 15:11,15,10.02.2019 03:00,3,28.55,11.82,Feb,Saturday,late afternoon (15-18),Between 9 and 12 hours,2019-02-09 15:11:00,2019-02-10 03:00:00,11.816666666666666,2019-02-09
148,AsO2,AsO2-1,Private,Private,10.02.2019 15:42,15,10.02.2019 22:17,22,12.18,6.581111111,Feb,Sunday,late afternoon (15-18),Between 6 and 9  hours,2019-02-10 15:42:00,2019-02-10 22:17:00,6.583333333333333,2019-02-10
149,AsO2,AsO2-1,Private,Private,11.02.2019 16:11,16,12.02.2019 11:29,11,12.78,19.29027778,Feb,Monday,late afternoon (15-18),More than 18 hours,2019-02-11 16:11:00,2019-02-12 11:29:00,19.3,2019-02-11
150,UT9,Share-12,Shared,Shared-12,11.02.2019 20:47,20,12.02.2019 07:40,7,26.67,10.87916667,Feb,Monday,early evening (18-21),Between 9 and 12 hours,2019-02-11 20:47:00,2019-02-12 07:40:00,10.883333333333333,2019-02-11
151,AsO2,AsO2-1,Private,Private,12.02.2019 16:49,16,12.02.2019 22:01,22,14.42,5.199444444,Feb,Tuesday,late afternoon (15-18),Between 3 and 6 hours,2019-02-12 16:49:00,2019-02-12 22:01:00,5.2,2019-02-12
152,AsO2,AsO2-1,Private,Private,13.02.2019 18:20,18,14.02.2019 07:14,7,14.38,12.89083333,Feb,Wednesday,early evening (18-21),Between 12 and 15 hours,2019-02-13 18:20:00,2019-02-14 07:14:00,12.9,2019-02-13
154,UT9,Share-14,Shared,Shared-12,13.02.2019 22:56,22,14.02.2019 06:57,6,16.82,8.015555556,Feb,Wednesday,late evening (21-midnight),Between 6 and 9  hours,2019-02-13 22:56:00,2019-02-14 06:57:00,8.016666666666667,2019-02-13
155,UT9,Share-12,Shared,Shared-12,14.02.2019 16:07,16,14.02.2019 17:40,17,9.53,1.559722222,Feb,Thursday,late afternoon (15-18),Less than 3 hours,2019-02-14 16:07:00,2019-02-14 17:40:00,1.55,2019-02-14
156,AsO2,AsO2-1,Private,Private,14.02.2019 16:45,16,15.02.2019 02:30,2,10.94,9.746111111,Feb,Thursday,late afternoon (15-18),Between 9 and 12 hours,2019-02-14 16:45:00,2019-02-15 02:30:00,9.75,2019-02-14
157,UT9,Share-12,Shared,Shared-12,14.02.2019 17:40,17,14.02.2019 21:29,21,21.42,3.805,Feb,Thursday,late afternoon (15-18),Between 3 and 6 hours,2019-02-14 17:40:00,2019-02-14 21:29:00,3.816666666666667,2019-02-14
158,Bl2,Bl2-2,Private,Private,14.02.2019 19:17,19,15.02.2019 09:32,9,13.8,14.25305556,Feb,Thursday,early evening (18-21),Between 12 and 15 hours,2019-02-14 19:17:00,2019-02-15 09:32:00,14.25,2019-02-14
159,Bl2,Share-8,Shared,Shared-6,15.02.2019 09:30,9,15.02.2019 10:14,10,4.41,0.730555556,Feb,Friday,late morning (9-12),Less than 3 hours,2019-02-15 09:30:00,2019-02-15 10:14:00,0.7333333333333333,2019-02-15
160,AdO1,AdO1-2,Private,Private,15.02.2019 13:20,13,16.02.2019 15:48,15,4.93,26.45611111,Feb,Friday,early afternoon (12-15),More than 18 hours,2019-02-15 13:20:00,2019-02-16 15:48:00,26.466666666666665,2019-02-15
161,Bl2,Bl2-6,Private,Private,15.02.2019 15:03,15,16.02.2019 10:28,10,10.21,19.41722222,Feb,Friday,late afternoon (15-18),More than 18 hours,2019-02-15 15:03:00,2019-02-16 10:28:00,19.416666666666668,2019-02-15
162,Bl2,Bl2-5,Private,Private,15.02.2019 15:48,15,15.02.2019 16:18,16,1.82,0.515555556,Feb,Friday,late afternoon (15-18),Less than 3 hours,2019-02-15 15:48:00,2019-02-15 16:18:00,0.5,2019-02-15
163,Bl2,Bl2-1,Private,Private,15.02.2019 15:54,15,16.02.2019 13:19,13,10.16,21.42555556,Feb,Friday,late afternoon (15-18),More than 18 hours,2019-02-15 15:54:00,2019-02-16 13:19:00,21.416666666666668,2019-02-15
164,Bl2,Bl2-5,Private,Private,15.02.2019 16:56,16,16.02.2019 11:52,11,8.45,18.94666667,Feb,Friday,late afternoon (15-18),More than 18 hours,2019-02-15 16:56:00,2019-02-16 11:52:00,18.933333333333334,2019-02-15
165,AdO3,AdO3-2,Private,Private,15.02.2019 17:36,17,16.02.2019 13:42,13,7.45,20.09694444,Feb,Friday,late afternoon (15-18),More than 18 hours,2019-02-15 17:36:00,2019-02-16 13:42:00,20.1,2019-02-15
166,AdO1,AdO1-1,Private,Private,15.02.2019 19:04,19,16.02.2019 06:31,6,20.58,11.46055556,Feb,Friday,early evening (18-21),Between 9 and 12 hours,2019-02-15 19:04:00,2019-02-16 06:31:00,11.45,2019-02-15
167,Bl2,Bl2-4,Private,Private,15.02.2019 19:28,19,16.02.2019 14:37,14,14.29,19.14472222,Feb,Friday,early evening (18-21),More than 18 hours,2019-02-15 19:28:00,2019-02-16 14:37:00,19.15,2019-02-15
168,UT9,Share-12,Shared,Shared-12,15.02.2019 19:31,19,15.02.2019 22:40,22,17.66,3.146944444,Feb,Friday,early evening (18-21),Between 3 and 6 hours,2019-02-15 19:31:00,2019-02-15 22:40:00,3.15,2019-02-15
169,Bl2,Share-8,Shared,Shared-6,15.02.2019 23:43,23,16.02.2019 08:15,8,16.96,8.542777778,Feb,Friday,late evening (21-midnight),Between 6 and 9  hours,2019-02-15 23:43:00,2019-02-16 08:15:00,8.533333333333333,2019-02-15
170,Bl2,Bl2-6,Private,Private,16.02.2019 12:31,12,17.02.2019 21:57,21,13.83,33.43833333,Feb,Saturday,early afternoon (12-15),More than 18 hours,2019-02-16 12:31:00,2019-02-17 21:57:00,33.43333333333333,2019-02-16
171,AdO3,AdO3-2,Private,Private,16.02.2019 16:21,16,16.02.2019 23:08,23,11.87,6.783055556,Feb,Saturday,late afternoon (15-18),Between 6 and 9  hours,2019-02-16 16:21:00,2019-02-16 23:08:00,6.783333333333333,2019-02-16
173,AdO3,AdO3-3,Private,Private,16.02.2019 17:41,17,16.02.2019 17:51,17,0.61,0.177222222,Feb,Saturday,late afternoon (15-18),Less than 3 hours,2019-02-16 17:41:00,2019-02-16 17:51:00,0.16666666666666666,2019-02-16
174,AsO2,AsO2-1,Private,Private,16.02.2019 22:54,22,18.02.2019 08:18,8,18.56,33.39833333,Feb,Saturday,late evening (21-midnight),More than 18 hours,2019-02-16 22:54:00,2019-02-18 08:18:00,33.4,2019-02-16
175,Bl2,Bl2-5,Private,Private,16.02.2019 22:57,22,17.02.2019 10:19,10,13.21,11.36861111,Feb,Saturday,late evening (21-midnight),Between 9 and 12 hours,2019-02-16 22:57:00,2019-02-17 10:19:00,11.366666666666667,2019-02-16
176,AdO1,AdO1-1,Private,Private,16.02.2019 23:47,23,17.02.2019 12:34,12,16.92,12.77416667,Feb,Saturday,late evening (21-midnight),Between 12 and 15 hours,2019-02-16 23:47:00,2019-02-17 12:34:00,12.783333333333333,2019-02-16
177,AdO3,AdO3-2,Private,Private,17.02.2019 01:11,1,17.02.2019 15:51,15,15.03,14.66083333,Feb,Sunday,early night (midnight-3),Between 12 and 15 hours,2019-02-17 01:11:00,2019-02-17 15:51:00,14.666666666666666,2019-02-17
178,Bl2,Bl2-5,Private,Private,17.02.2019 13:41,13,17.02.2019 15:53,15,3.94,2.194722222,Feb,Sunday,early afternoon (12-15),Less than 3 hours,2019-02-17 13:41:00,2019-02-17 15:53:00,2.2,2019-02-17
179,AsO2,Share-4,Shared,Shared-5,17.02.2019 13:53,13,17.02.2019 16:56,16,6.91,3.053333333,Feb,Sunday,early afternoon (12-15),Between 3 and 6 hours,2019-02-17 13:53:00,2019-02-17 16:56:00,3.05,2019-02-17
180,Bl2,Bl2-2,Private,Private,17.02.2019 14:15,14,17.02.2019 16:04,16,6.55,1.824166667,Feb,Sunday,early afternoon (12-15),Less than 3 hours,2019-02-17 14:15:00,2019-02-17 16:04:00,1.8166666666666667,2019-02-17
181,Bl2,Bl2-1,Private,Private,17.02.2019 14:19,14,18.02.2019 08:57,8,7.93,18.6325,Feb,Sunday,early afternoon (12-15),More than 18 hours,2019-02-17 14:19:00,2019-02-18 08:57:00,18.633333333333333,2019-02-17
182,AdO1,AdO1-2,Private,Private,17.02.2019 14:27,14,17.02.2019 21:05,21,7.88,6.640555556,Feb,Sunday,early afternoon (12-15),Between 6 and 9  hours,2019-02-17 14:27:00,2019-02-17 21:05:00,6.633333333333334,2019-02-17
183,AdO1,AdO1-1,Private,Private,17.02.2019 15:19,15,17.02.2019 21:31,21,8.46,6.203611111,Feb,Sunday,late afternoon (15-18),Between 6 and 9  hours,2019-02-17 15:19:00,2019-02-17 21:31:00,6.2,2019-02-17
184,UT9,Share-6,Shared,Shared-12,17.02.2019 17:34,17,17.02.2019 20:00,20,14.27,2.438333333,Feb,Sunday,late afternoon (15-18),Less than 3 hours,2019-02-17 17:34:00,2019-02-17 20:00:00,2.433333333333333,2019-02-17
185,Bl2,Bl2-2,Private,Private,17.02.2019 19:12,19,17.02.2019 21:28,21,8.15,2.263611111,Feb,Sunday,early evening (18-21),Less than 3 hours,2019-02-17 19:12:00,2019-02-17 21:28:00,2.2666666666666666,2019-02-17
187,Bl2,Bl2-2,Private,Private,17.02.2019 22:17,22,18.02.2019 08:50,8,11.43,10.55055556,Feb,Sunday,late evening (21-midnight),Between 9 and 12 hours,2019-02-17 22:17:00,2019-02-18 08:50:00,10.55,2019-02-17
188,Bl2,Bl2-5,Private,Private,17.02.2019 22:58,22,18.02.2019 07:45,7,11.3,8.777777778,Feb,Sunday,late evening (21-midnight),Between 6 and 9  hours,2019-02-17 22:58:00,2019-02-18 07:45:00,8.783333333333333,2019-02-17
189,UT9,Share-14,Shared,Shared-12,18.02.2019 10:20,10,18.02.2019 13:31,13,11.79,3.176388889,Feb,Monday,late morning (9-12),Between 3 and 6 hours,2019-02-18 10:20:00,2019-02-18 13:31:00,3.183333333333333,2019-02-18
190,Bl2,Bl2-5,Private,Private,18.02.2019 16:27,16,19.02.2019 07:54,7,8.95,15.45861111,Feb,Monday,late afternoon (15-18),Between 15 and 18 hours,2019-02-18 16:27:00,2019-02-19 07:54:00,15.45,2019-02-18
191,UT9,Share-12,Shared,Shared-12,18.02.2019 17:47,17,18.02.2019 22:34,22,26.81,4.775555556,Feb,Monday,late afternoon (15-18),Between 3 and 6 hours,2019-02-18 17:47:00,2019-02-18 22:34:00,4.783333333333333,2019-02-18
192,Bl2,Bl2-6,Private,Private,18.02.2019 20:26,20,19.02.2019 07:57,7,13.21,11.51472222,Feb,Monday,early evening (18-21),Between 9 and 12 hours,2019-02-18 20:26:00,2019-02-19 07:57:00,11.516666666666667,2019-02-18
193,AdO3,AdO3-3,Private,Private,18.02.2019 23:32,23,19.02.2019 14:58,14,15.7,15.4475,Feb,Monday,late evening (21-midnight),Between 15 and 18 hours,2019-02-18 23:32:00,2019-02-19 14:58:00,15.433333333333334,2019-02-18
194,Bl2,Bl2-1,Private,Private,19.02.2019 07:45,7,19.02.2019 09:01,9,4.52,1.261944444,Feb,Tuesday,early morning (6-9),Less than 3 hours,2019-02-19 07:45:00,2019-02-19 09:01:00,1.2666666666666666,2019-02-19
195,Bl2,Bl2-1,Private,Private,19.02.2019 15:07,15,19.02.2019 17:40,17,9.15,2.555,Feb,Tuesday,late afternoon (15-18),Less than 3 hours,2019-02-19 15:07:00,2019-02-19 17:40:00,2.55,2019-02-19
196,Bl2,Bl2-5,Private,Private,19.02.2019 16:21,16,19.02.2019 18:44,18,8.32,2.379722222,Feb,Tuesday,late afternoon (15-18),Less than 3 hours,2019-02-19 16:21:00,2019-02-19 18:44:00,2.3833333333333333,2019-02-19
197,AsO2,AsO2-1,Private,Private,19.02.2019 16:51,16,20.02.2019 08:01,8,15.13,15.17194444,Feb,Tuesday,late afternoon (15-18),Between 15 and 18 hours,2019-02-19 16:51:00,2019-02-20 08:01:00,15.166666666666666,2019-02-19
198,Bl2,Bl2-1,Private,Private,19.02.2019 18:15,18,19.02.2019 21:51,21,8.23,3.603333333,Feb,Tuesday,early evening (18-21),Between 3 and 6 hours,2019-02-19 18:15:00,2019-02-19 21:51:00,3.6,2019-02-19
199,AdO1,AdO1-2,Private,Private,19.02.2019 18:49,18,20.02.2019 12:21,12,11.69,17.52805556,Feb,Tuesday,early evening (18-21),Between 15 and 18 hours,2019-02-19 18:49:00,2019-02-20 12:21:00,17.533333333333335,2019-02-19
200,AdO3,AdO3-2,Private,Private,19.02.2019 19:40,19,20.02.2019 12:29,12,16.43,16.81666667,Feb,Tuesday,early evening (18-21),Between 15 and 18 hours,2019-02-19 19:40:00,2019-02-20 12:29:00,16.816666666666666,2019-02-19
201,Bl2,Bl2-4,Private,Private,19.02.2019 20:06,20,20.02.2019 10:32,10,16.52,14.42583333,Feb,Tuesday,early evening (18-21),Between 12 and 15 hours,2019-02-19 20:06:00,2019-02-20 10:32:00,14.433333333333334,2019-02-19
202,Bl2,Bl2-5,Private,Private,19.02.2019 21:01,21,20.02.2019 07:16,7,4.55,10.23944444,Feb,Tuesday,late evening (21-midnight),Between 9 and 12 hours,2019-02-19 21:01:00,2019-02-20 07:16:00,10.25,2019-02-19
203,AdO1,AdO1-1,Private,Private,19.02.2019 21:48,21,20.02.2019 06:29,6,17.56,8.691944444,Feb,Tuesday,late evening (21-midnight),Between 6 and 9  hours,2019-02-19 21:48:00,2019-02-20 06:29:00,8.683333333333334,2019-02-19
204,Bl2,Bl2-1,Private,Private,19.02.2019 21:51,21,20.02.2019 09:36,9,0.96,11.75555556,Feb,Tuesday,late evening (21-midnight),Between 9 and 12 hours,2019-02-19 21:51:00,2019-02-20 09:36:00,11.75,2019-02-19
205,Bl2,Bl2-1,Private,Private,20.02.2019 11:54,11,20.02.2019 15:14,15,11.97,3.324722222,Feb,Wednesday,late morning (9-12),Between 3 and 6 hours,2019-02-20 11:54:00,2019-02-20 15:14:00,3.3333333333333335,2019-02-20
206,UT9,Share-14,Shared,Shared-12,20.02.2019 15:22,15,20.02.2019 20:28,20,16.14,5.091111111,Feb,Wednesday,late afternoon (15-18),Between 3 and 6 hours,2019-02-20 15:22:00,2019-02-20 20:28:00,5.1,2019-02-20
207,Bl2,Bl2-5,Private,Private,20.02.2019 16:00,16,20.02.2019 16:48,16,2.88,0.810833333,Feb,Wednesday,late afternoon (15-18),Less than 3 hours,2019-02-20 16:00:00,2019-02-20 16:48:00,0.8,2019-02-20
208,Bl2,Bl2-5,Private,Private,20.02.2019 17:26,17,20.02.2019 20:21,20,9.96,2.914722222,Feb,Wednesday,late afternoon (15-18),Less than 3 hours,2019-02-20 17:26:00,2019-02-20 20:21:00,2.9166666666666665,2019-02-20
209,Bl2,Bl2-1,Private,Private,20.02.2019 18:42,18,20.02.2019 21:02,21,7.04,2.346944444,Feb,Wednesday,early evening (18-21),Less than 3 hours,2019-02-20 18:42:00,2019-02-20 21:02:00,2.3333333333333335,2019-02-20
210,Bl2,Bl2-5,Private,Private,20.02.2019 20:49,20,21.02.2019 02:52,2,4.05,6.050555556,Feb,Wednesday,early evening (18-21),Between 6 and 9  hours,2019-02-20 20:49:00,2019-02-21 02:52:00,6.05,2019-02-20
211,Bl2,Bl2-6,Private,Private,21.02.2019 10:58,10,21.02.2019 17:22,17,6.99,6.392777778,Feb,Thursday,late morning (9-12),Between 6 and 9  hours,2019-02-21 10:58:00,2019-02-21 17:22:00,6.4,2019-02-21
212,Bl2,Bl2-2,Private,Private,21.02.2019 13:07,13,22.02.2019 12:22,12,9.51,23.24638889,Feb,Thursday,early afternoon (12-15),More than 18 hours,2019-02-21 13:07:00,2019-02-22 12:22:00,23.25,2019-02-21
213,AdO1,AdO1-2,Private,Private,21.02.2019 16:44,16,22.02.2019 10:20,10,4.9,17.59,Feb,Thursday,late afternoon (15-18),Between 15 and 18 hours,2019-02-21 16:44:00,2019-02-22 10:20:00,17.6,2019-02-21
214,Bl2,Bl2-1,Private,Private,21.02.2019 18:27,18,22.02.2019 12:22,12,11.78,17.91138889,Feb,Thursday,early evening (18-21),Between 15 and 18 hours,2019-02-21 18:27:00,2019-02-22 12:22:00,17.916666666666668,2019-02-21
215,Bl2,Bl2-6,Private,Private,21.02.2019 19:44,19,22.02.2019 12:24,12,7.51,16.66277778,Feb,Thursday,early evening (18-21),Between 15 and 18 hours,2019-02-21 19:44:00,2019-02-22 12:24:00,16.666666666666668,2019-02-21
216,AsO2,AsO2-1,Private,Private,22.02.2019 10:57,10,25.02.2019 07:14,7,18.48,68.2825,Feb,Friday,late morning (9-12),More than 18 hours,2019-02-22 10:57:00,2019-02-25 07:14:00,68.28333333333333,2019-02-22
217,AdO3,AdO3-2,Private,Private,22.02.2019 18:35,18,22.02.2019 19:43,19,4.22,1.133333333,Feb,Friday,early evening (18-21),Less than 3 hours,2019-02-22 18:35:00,2019-02-22 19:43:00,1.1333333333333333,2019-02-22
218,Bl2,Bl2-2,Private,Private,22.02.2019 20:31,20,23.02.2019 08:11,8,20.12,11.6725,Feb,Friday,early evening (18-21),Between 9 and 12 hours,2019-02-22 20:31:00,2019-02-23 08:11:00,11.666666666666666,2019-02-22
219,Bl2,Bl2-1,Private,Private,22.02.2019 21:10,21,23.02.2019 09:14,9,7.47,12.06555556,Feb,Friday,late evening (21-midnight),Between 12 and 15 hours,2019-02-22 21:10:00,2019-02-23 09:14:00,12.066666666666666,2019-02-22
220,AdO3,AdO3-2,Private,Private,23.02.2019 01:13,1,24.02.2019 15:28,15,17.6,38.24555556,Feb,Saturday,early night (midnight-3),More than 18 hours,2019-02-23 01:13:00,2019-02-24 15:28:00,38.25,2019-02-23
221,AdO1,AdO1-2,Private,Private,23.02.2019 17:01,17,24.02.2019 16:34,16,7.41,23.555,Feb,Saturday,late afternoon (15-18),More than 18 hours,2019-02-23 17:01:00,2019-02-24 16:34:00,23.55,2019-02-23
222,AdO1,AdO1-1,Private,Private,23.02.2019 17:25,17,24.02.2019 08:49,8,16.37,15.40222222,Feb,Saturday,late afternoon (15-18),Between 15 and 18 hours,2019-02-23 17:25:00,2019-02-24 08:49:00,15.4,2019-02-23
223,Bl2,Bl2-6,Private,Private,23.02.2019 21:45,21,25.02.2019 09:08,9,13.55,35.38027778,Feb,Saturday,late evening (21-midnight),More than 18 hours,2019-02-23 21:45:00,2019-02-25 09:08:00,35.38333333333333,2019-02-23
224,Bl2,Bl2-1,Private,Private,23.02.2019 21:48,21,24.02.2019 13:50,13,10.28,16.03694444,Feb,Saturday,late evening (21-midnight),Between 15 and 18 hours,2019-02-23 21:48:00,2019-02-24 13:50:00,16.033333333333335,2019-02-23
225,Bl2,Bl2-5,Private,Private,24.02.2019 18:18,18,25.02.2019 07:18,7,9.27,12.99194444,Feb,Sunday,early evening (18-21),Between 12 and 15 hours,2019-02-24 18:18:00,2019-02-25 07:18:00,13.0,2019-02-24
226,UT9,Share-12,Shared,Shared-12,24.02.2019 19:21,19,25.02.2019 06:03,6,30.86,10.70361111,Feb,Sunday,early evening (18-21),Between 9 and 12 hours,2019-02-24 19:21:00,2019-02-25 06:03:00,10.7,2019-02-24
227,Bl2,Bl2-2,Private,Private,24.02.2019 22:12,22,25.02.2019 07:02,7,0.36,8.832777778,Feb,Sunday,late evening (21-midnight),Between 6 and 9  hours,2019-02-24 22:12:00,2019-02-25 07:02:00,8.833333333333334,2019-02-24
228,Bl2,Share-8,Shared,Shared-6,25.02.2019 00:49,0,25.02.2019 12:42,12,27.05,11.89333333,Feb,Monday,early night (midnight-3),Between 9 and 12 hours,2019-02-25 00:49:00,2019-02-25 12:42:00,11.883333333333333,2019-02-25
229,Bl2,Bl2-2,Private,Private,25.02.2019 14:50,14,25.02.2019 17:57,17,11.23,3.115277778,Feb,Monday,early afternoon (12-15),Between 3 and 6 hours,2019-02-25 14:50:00,2019-02-25 17:57:00,3.1166666666666667,2019-02-25
230,AsO2,AsO2-1,Private,Private,25.02.2019 16:27,16,26.02.2019 07:32,7,13.19,15.095,Feb,Monday,late afternoon (15-18),Between 15 and 18 hours,2019-02-25 16:27:00,2019-02-26 07:32:00,15.083333333333334,2019-02-25
231,Bl2,Bl2-5,Private,Private,25.02.2019 17:44,17,25.02.2019 20:27,20,9.74,2.724444444,Feb,Monday,late afternoon (15-18),Less than 3 hours,2019-02-25 17:44:00,2019-02-25 20:27:00,2.716666666666667,2019-02-25
232,Bl2,Bl2-1,Private,Private,25.02.2019 18:36,18,26.02.2019 10:13,10,9.45,15.61555556,Feb,Monday,early evening (18-21),Between 15 and 18 hours,2019-02-25 18:36:00,2019-02-26 10:13:00,15.616666666666667,2019-02-25
233,Bl2,Bl2-6,Private,Private,26.02.2019 10:32,10,27.02.2019 11:20,11,12.97,24.79527778,Feb,Tuesday,late morning (9-12),More than 18 hours,2019-02-26 10:32:00,2019-02-27 11:20:00,24.8,2019-02-26
234,AdO3,AdO3-3,Private,Private,26.02.2019 15:50,15,27.02.2019 07:21,7,17.71,15.51277778,Feb,Tuesday,late afternoon (15-18),Between 15 and 18 hours,2019-02-26 15:50:00,2019-02-27 07:21:00,15.516666666666667,2019-02-26
235,Bl2,Bl2-5,Private,Private,26.02.2019 16:22,16,26.02.2019 16:47,16,1.43,0.411666667,Feb,Tuesday,late afternoon (15-18),Less than 3 hours,2019-02-26 16:22:00,2019-02-26 16:47:00,0.4166666666666667,2019-02-26
236,AsO2,AsO2-1,Private,Private,26.02.2019 16:53,16,27.02.2019 07:07,7,12.84,14.24083333,Feb,Tuesday,late afternoon (15-18),Between 12 and 15 hours,2019-02-26 16:53:00,2019-02-27 07:07:00,14.233333333333333,2019-02-26
237,Bl2,Bl2-5,Private,Private,26.02.2019 17:31,17,26.02.2019 19:05,19,5.54,1.551666667,Feb,Tuesday,late afternoon (15-18),Less than 3 hours,2019-02-26 17:31:00,2019-02-26 19:05:00,1.5666666666666667,2019-02-26
238,Bl2,Bl2-1,Private,Private,26.02.2019 19:53,19,27.02.2019 08:28,8,8.74,12.5875,Feb,Tuesday,early evening (18-21),Between 12 and 15 hours,2019-02-26 19:53:00,2019-02-27 08:28:00,12.583333333333334,2019-02-26
239,Bl2,Bl2-4,Private,Private,26.02.2019 20:11,20,27.02.2019 09:56,9,18.03,13.73861111,Feb,Tuesday,early evening (18-21),Between 12 and 15 hours,2019-02-26 20:11:00,2019-02-27 09:56:00,13.75,2019-02-26
240,Bl2,Bl2-5,Private,Private,26.02.2019 22:44,22,27.02.2019 06:50,6,6.22,8.102777778,Feb,Tuesday,late evening (21-midnight),Between 6 and 9  hours,2019-02-26 22:44:00,2019-02-27 06:50:00,8.1,2019-02-26
241,UT9,Share-14,Shared,Shared-12,26.02.2019 23:30,23,27.02.2019 10:25,10,15.23,10.92277778,Feb,Tuesday,late evening (21-midnight),Between 9 and 12 hours,2019-02-26 23:30:00,2019-02-27 10:25:00,10.916666666666666,2019-02-26
242,Bl2,Bl2-5,Private,Private,27.02.2019 07:36,7,27.02.2019 09:38,9,7.22,2.02,Feb,Wednesday,early morning (6-9),Less than 3 hours,2019-02-27 07:36:00,2019-02-27 09:38:00,2.033333333333333,2019-02-27
243,Bl2,Bl2-5,Private,Private,27.02.2019 11:27,11,27.02.2019 16:50,16,6.0,5.3925,Feb,Wednesday,late morning (9-12),Between 3 and 6 hours,2019-02-27 11:27:00,2019-02-27 16:50:00,5.383333333333334,2019-02-27
244,AsO2,Share-6,Shared,Shared-5,27.02.2019 18:37,18,27.02.2019 21:00,21,12.89,2.380833333,Feb,Wednesday,early evening (18-21),Less than 3 hours,2019-02-27 18:37:00,2019-02-27 21:00:00,2.3833333333333333,2019-02-27
245,AdO3,AdO3-3,Private,Private,27.02.2019 18:54,18,28.02.2019 06:42,6,8.25,11.81277778,Feb,Wednesday,early evening (18-21),Between 9 and 12 hours,2019-02-27 18:54:00,2019-02-28 06:42:00,11.8,2019-02-27
246,AsO2,AsO2-1,Private,Private,27.02.2019 20:44,20,28.02.2019 07:21,7,12.99,10.61111111,Feb,Wednesday,early evening (18-21),Between 9 and 12 hours,2019-02-27 20:44:00,2019-02-28 07:21:00,10.616666666666667,2019-02-27
247,Bl2,Bl2-1,Private,Private,28.02.2019 15:16,15,28.02.2019 17:10,17,6.82,1.896944444,Feb,Thursday,late afternoon (15-18),Less than 3 hours,2019-02-28 15:16:00,2019-02-28 17:10:00,1.9,2019-02-28
248,AsO2,AsO2-1,Private,Private,28.02.2019 16:21,16,01.03.2019 07:19,7,13.74,14.97166667,Feb,Thursday,late afternoon (15-18),Between 12 and 15 hours,2019-02-28 16:21:00,2019-03-01 07:19:00,14.966666666666667,2019-02-28
249,Bl2,Bl2-1,Shared,Shared-6,28.02.2019 16:47,16,28.02.2019 18:21,18,3.44,1.572222222,Feb,Thursday,late afternoon (15-18),Less than 3 hours,2019-02-28 16:47:00,2019-02-28 18:21:00,1.5666666666666667,2019-02-28
250,UT9,Share-12,Shared,Shared-12,28.02.2019 17:10,17,28.02.2019 21:35,21,27.26,4.406111111,Feb,Thursday,late afternoon (15-18),Between 3 and 6 hours,2019-02-28 17:10:00,2019-02-28 21:35:00,4.416666666666667,2019-02-28
251,AdO1,AdO1-2,Private,Private,28.02.2019 17:44,17,01.03.2019 10:01,10,5.61,16.28638889,Feb,Thursday,late afternoon (15-18),Between 15 and 18 hours,2019-02-28 17:44:00,2019-03-01 10:01:00,16.283333333333335,2019-02-28
252,Bl2,Bl2-1,Private,Private,28.02.2019 18:04,18,28.02.2019 18:29,18,1.49,0.419444444,Feb,Thursday,early evening (18-21),Less than 3 hours,2019-02-28 18:04:00,2019-02-28 18:29:00,0.4166666666666667,2019-02-28
253,AdO1,AdO1-3,Private,Private,28.02.2019 19:02,19,01.03.2019 09:56,9,19.48,14.90222222,Feb,Thursday,early evening (18-21),Between 12 and 15 hours,2019-02-28 19:02:00,2019-03-01 09:56:00,14.9,2019-02-28
254,Bl2,Bl2-1,Private,Private,28.02.2019 20:59,20,01.03.2019 06:55,6,17.22,9.9425,Feb,Thursday,early evening (18-21),Between 9 and 12 hours,2019-02-28 20:59:00,2019-03-01 06:55:00,9.933333333333334,2019-02-28
255,AdO1,AdO1-1,Private,Private,28.02.2019 21:47,21,01.03.2019 06:27,6,15.39,8.653055556,Feb,Thursday,late evening (21-midnight),Between 6 and 9  hours,2019-02-28 21:47:00,2019-03-01 06:27:00,8.666666666666666,2019-02-28
256,Bl2,Bl2-1,Private,Private,01.03.2019 15:41,15,01.03.2019 16:34,16,2.65,0.878333333,Mar,Friday,late afternoon (15-18),Less than 3 hours,2019-03-01 15:41:00,2019-03-01 16:34:00,0.8833333333333333,2019-03-01
257,AdO3,AdO3-2,Private,Private,01.03.2019 17:53,17,01.03.2019 22:16,22,8.06,4.385277778,Mar,Friday,late afternoon (15-18),Between 3 and 6 hours,2019-03-01 17:53:00,2019-03-01 22:16:00,4.383333333333334,2019-03-01
258,Bl2,Bl2-5,Private,Private,01.03.2019 18:05,18,01.03.2019 18:58,18,3.14,0.884166667,Mar,Friday,early evening (18-21),Less than 3 hours,2019-03-01 18:05:00,2019-03-01 18:58:00,0.8833333333333333,2019-03-01
259,AsO2,AsO2-1,Private,Private,01.03.2019 18:22,18,02.03.2019 11:00,11,15.87,16.64361111,Mar,Friday,early evening (18-21),Between 15 and 18 hours,2019-03-01 18:22:00,2019-03-02 11:00:00,16.633333333333333,2019-03-01
260,AdO1,AdO1-3,Private,Private,01.03.2019 19:01,19,03.03.2019 15:08,15,18.46,44.12305556,Mar,Friday,early evening (18-21),More than 18 hours,2019-03-01 19:01:00,2019-03-03 15:08:00,44.11666666666667,2019-03-01
261,Bl2,Bl2-5,Private,Private,01.03.2019 19:27,19,01.03.2019 21:50,21,8.53,2.381666667,Mar,Friday,early evening (18-21),Less than 3 hours,2019-03-01 19:27:00,2019-03-01 21:50:00,2.3833333333333333,2019-03-01
262,Bl2,Bl2-4,Private,Private,01.03.2019 20:00,20,02.03.2019 15:56,15,20.35,19.94111111,Mar,Friday,early evening (18-21),More than 18 hours,2019-03-01 20:00:00,2019-03-02 15:56:00,19.933333333333334,2019-03-01
263,Bl2,Bl2-1,Private,Private,01.03.2019 20:58,20,02.03.2019 08:26,8,11.5,11.47611111,Mar,Friday,early evening (18-21),Between 9 and 12 hours,2019-03-01 20:58:00,2019-03-02 08:26:00,11.466666666666667,2019-03-01
264,AdO1,AdO1-1,Private,Private,01.03.2019 22:04,22,02.03.2019 06:38,6,17.91,8.556666667,Mar,Friday,late evening (21-midnight),Between 6 and 9  hours,2019-03-01 22:04:00,2019-03-02 06:38:00,8.566666666666666,2019-03-01
265,UT9,Share-6,Shared,Shared-12,01.03.2019 22:23,22,02.03.2019 01:30,1,17.21,3.118888889,Mar,Friday,late evening (21-midnight),Between 3 and 6 hours,2019-03-01 22:23:00,2019-03-02 01:30:00,3.1166666666666667,2019-03-01
266,Bl2,Bl2-5,Private,Private,01.03.2019 22:26,22,02.03.2019 14:22,14,6.28,15.94638889,Mar,Friday,late evening (21-midnight),Between 15 and 18 hours,2019-03-01 22:26:00,2019-03-02 14:22:00,15.933333333333334,2019-03-01
267,AdO3,AdO3-2,Private,Private,01.03.2019 23:56,23,03.03.2019 12:28,12,15.78,36.53416667,Mar,Friday,late evening (21-midnight),More than 18 hours,2019-03-01 23:56:00,2019-03-03 12:28:00,36.53333333333333,2019-03-01
268,AsO2,Share-4,Shared,Shared-5,02.03.2019 09:22,9,02.03.2019 16:24,16,6.96,7.038333333,Mar,Saturday,late morning (9-12),Between 6 and 9  hours,2019-03-02 09:22:00,2019-03-02 16:24:00,7.033333333333333,2019-03-02
269,Bl2,Bl2-2,Private,Private,02.03.2019 10:18,10,02.03.2019 12:22,12,7.26,2.075,Mar,Saturday,late morning (9-12),Less than 3 hours,2019-03-02 10:18:00,2019-03-02 12:22:00,2.066666666666667,2019-03-02
270,AdO3,AdO3-4,Private,Private,02.03.2019 13:38,13,02.03.2019 16:53,16,21.72,3.248888889,Mar,Saturday,early afternoon (12-15),Between 3 and 6 hours,2019-03-02 13:38:00,2019-03-02 16:53:00,3.25,2019-03-02
271,AdO1,AdO1-1,Private,Private,02.03.2019 15:37,15,02.03.2019 18:43,18,11.22,3.088611111,Mar,Saturday,late afternoon (15-18),Between 3 and 6 hours,2019-03-02 15:37:00,2019-03-02 18:43:00,3.1,2019-03-02
272,Bl2,Bl2-1,Private,Private,02.03.2019 17:25,17,02.03.2019 18:33,18,4.07,1.135833333,Mar,Saturday,late afternoon (15-18),Less than 3 hours,2019-03-02 17:25:00,2019-03-02 18:33:00,1.1333333333333333,2019-03-02
273,AdO1,AdO1-2,Private,Private,02.03.2019 17:57,17,03.03.2019 14:46,14,5.97,20.81361111,Mar,Saturday,late afternoon (15-18),More than 18 hours,2019-03-02 17:57:00,2019-03-03 14:46:00,20.816666666666666,2019-03-02
274,Bl2,Bl2-5,Private,Private,02.03.2019 18:10,18,02.03.2019 18:53,18,2.55,0.723333333,Mar,Saturday,early evening (18-21),Less than 3 hours,2019-03-02 18:10:00,2019-03-02 18:53:00,0.7166666666666667,2019-03-02
275,Bl2,Bl2-5,Private,Private,02.03.2019 19:26,19,03.03.2019 00:28,0,8.9,5.045833333,Mar,Saturday,early evening (18-21),Between 3 and 6 hours,2019-03-02 19:26:00,2019-03-03 00:28:00,5.033333333333333,2019-03-02
276,Bl2,Bl2-1,Private,Private,02.03.2019 19:42,19,03.03.2019 09:01,9,12.48,13.3175,Mar,Saturday,early evening (18-21),Between 12 and 15 hours,2019-03-02 19:42:00,2019-03-03 09:01:00,13.316666666666666,2019-03-02
277,AdO1,AdO1-1,Private,Private,02.03.2019 21:25,21,03.03.2019 11:15,11,12.52,13.83111111,Mar,Saturday,late evening (21-midnight),Between 12 and 15 hours,2019-03-02 21:25:00,2019-03-03 11:15:00,13.833333333333334,2019-03-02
278,AsO2,Share-4,Shared,Shared-5,03.03.2019 12:55,12,03.03.2019 16:37,16,6.65,3.704166667,Mar,Sunday,early afternoon (12-15),Between 3 and 6 hours,2019-03-03 12:55:00,2019-03-03 16:37:00,3.7,2019-03-03
279,Bl2,Bl2-5,Private,Private,03.03.2019 13:17,13,03.03.2019 16:16,16,7.15,2.975833333,Mar,Sunday,early afternoon (12-15),Less than 3 hours,2019-03-03 13:17:00,2019-03-03 16:16:00,2.9833333333333334,2019-03-03
280,Bl2,Bl2-2,Private,Private,03.03.2019 13:35,13,03.03.2019 15:15,15,6.05,1.679722222,Mar,Sunday,early afternoon (12-15),Less than 3 hours,2019-03-03 13:35:00,2019-03-03 15:15:00,1.6666666666666667,2019-03-03
281,UT9,Share-12,Shared,Shared-12,03.03.2019 13:40,13,04.03.2019 06:08,6,31.93,16.4575,Mar,Sunday,early afternoon (12-15),Between 15 and 18 hours,2019-03-03 13:40:00,2019-03-04 06:08:00,16.466666666666665,2019-03-03
282,AdO3,AdO3-3,Private,Private,03.03.2019 14:27,14,04.03.2019 08:25,8,21.09,17.97194444,Mar,Sunday,early afternoon (12-15),Between 15 and 18 hours,2019-03-03 14:27:00,2019-03-04 08:25:00,17.966666666666665,2019-03-03
283,AdO1,AdO1-1,Private,Private,03.03.2019 15:04,15,04.03.2019 09:34,9,12.62,18.50944444,Mar,Sunday,late afternoon (15-18),More than 18 hours,2019-03-03 15:04:00,2019-03-04 09:34:00,18.5,2019-03-03
284,AdO1,AdO1-2,Private,Private,03.03.2019 18:45,18,04.03.2019 18:40,18,3.81,23.91694444,Mar,Sunday,early evening (18-21),More than 18 hours,2019-03-03 18:45:00,2019-03-04 18:40:00,23.916666666666668,2019-03-03
285,Bl2,Bl2-5,Private,Private,03.03.2019 19:15,19,03.03.2019 20:28,20,4.35,1.219166667,Mar,Sunday,early evening (18-21),Less than 3 hours,2019-03-03 19:15:00,2019-03-03 20:28:00,1.2166666666666666,2019-03-03
286,Bl2,Bl2-2,Private,Private,03.03.2019 21:33,21,04.03.2019 10:36,10,13.36,13.05277778,Mar,Sunday,late evening (21-midnight),Between 12 and 15 hours,2019-03-03 21:33:00,2019-03-04 10:36:00,13.05,2019-03-03
287,Bl2,Share-8,Shared,Shared-6,03.03.2019 23:04,23,04.03.2019 08:19,8,15.42,9.245277778,Mar,Sunday,late evening (21-midnight),Between 9 and 12 hours,2019-03-03 23:04:00,2019-03-04 08:19:00,9.25,2019-03-03
288,Bl2,Bl2-5,Private,Private,03.03.2019 23:29,23,04.03.2019 07:07,7,9.6,7.631111111,Mar,Sunday,late evening (21-midnight),Between 6 and 9  hours,2019-03-03 23:29:00,2019-03-04 07:07:00,7.633333333333334,2019-03-03
289,AdO1,AdO1-3,Private,Private,04.03.2019 17:19,17,05.03.2019 07:23,7,19.97,14.07,Mar,Monday,late afternoon (15-18),Between 12 and 15 hours,2019-03-04 17:19:00,2019-03-05 07:23:00,14.066666666666666,2019-03-04
290,AsO2,AsO2-1,Private,Private,04.03.2019 17:20,17,05.03.2019 07:12,7,12.27,13.855,Mar,Monday,late afternoon (15-18),Between 12 and 15 hours,2019-03-04 17:20:00,2019-03-05 07:12:00,13.866666666666667,2019-03-04
291,Bl2,Bl2-5,Private,Private,04.03.2019 19:22,19,04.03.2019 20:19,20,3.37,0.948888889,Mar,Monday,early evening (18-21),Less than 3 hours,2019-03-04 19:22:00,2019-03-04 20:19:00,0.95,2019-03-04
292,Bl2,Bl2-1,Private,Private,04.03.2019 20:24,20,05.03.2019 05:46,5,11.26,9.373055556,Mar,Monday,early evening (18-21),Between 9 and 12 hours,2019-03-04 20:24:00,2019-03-05 05:46:00,9.366666666666667,2019-03-04
293,Bl2,Bl2-5,Private,Private,04.03.2019 20:45,20,04.03.2019 21:44,21,3.48,0.978333333,Mar,Monday,early evening (18-21),Less than 3 hours,2019-03-04 20:45:00,2019-03-04 21:44:00,0.9833333333333333,2019-03-04
294,Bl2,Bl2-5,Private,Private,04.03.2019 22:13,22,05.03.2019 07:03,7,8.02,8.828333333,Mar,Monday,late evening (21-midnight),Between 6 and 9  hours,2019-03-04 22:13:00,2019-03-05 07:03:00,8.833333333333334,2019-03-04
295,AsO2,AsO2-1,Private,Private,05.03.2019 16:19,16,06.03.2019 07:19,7,14.05,14.99472222,Mar,Tuesday,late afternoon (15-18),Between 12 and 15 hours,2019-03-05 16:19:00,2019-03-06 07:19:00,15.0,2019-03-05
296,AdO1,AdO1-3,Private,Private,05.03.2019 17:17,17,06.03.2019 07:21,7,19.15,14.06805556,Mar,Tuesday,late afternoon (15-18),Between 12 and 15 hours,2019-03-05 17:17:00,2019-03-06 07:21:00,14.066666666666666,2019-03-05
297,AdO3,AdO3-2,Private,Private,05.03.2019 21:05,21,06.03.2019 13:06,13,13.9,16.01805556,Mar,Tuesday,late evening (21-midnight),Between 15 and 18 hours,2019-03-05 21:05:00,2019-03-06 13:06:00,16.016666666666666,2019-03-05
298,AdO1,AdO1-2,Private,Private,05.03.2019 21:53,21,06.03.2019 09:57,9,13.33,12.07805556,Mar,Tuesday,late evening (21-midnight),Between 12 and 15 hours,2019-03-05 21:53:00,2019-03-06 09:57:00,12.066666666666666,2019-03-05
299,AdO1,AdO1-1,Private,Private,05.03.2019 21:53,21,06.03.2019 06:32,6,21.28,8.660555556,Mar,Tuesday,late evening (21-midnight),Between 6 and 9  hours,2019-03-05 21:53:00,2019-03-06 06:32:00,8.65,2019-03-05
300,Bl2,Share-8,Shared,Shared-6,05.03.2019 22:38,22,06.03.2019 11:04,11,13.04,12.44944444,Mar,Tuesday,late evening (21-midnight),Between 12 and 15 hours,2019-03-05 22:38:00,2019-03-06 11:04:00,12.433333333333334,2019-03-05
301,Bl2,Bl2-5,Private,Private,06.03.2019 16:08,16,06.03.2019 16:47,16,2.35,0.663055556,Mar,Wednesday,late afternoon (15-18),Less than 3 hours,2019-03-06 16:08:00,2019-03-06 16:47:00,0.65,2019-03-06
302,AdO3,AdO3-2,Private,Private,06.03.2019 17:18,17,07.03.2019 18:33,18,8.74,25.25166667,Mar,Wednesday,late afternoon (15-18),More than 18 hours,2019-03-06 17:18:00,2019-03-07 18:33:00,25.25,2019-03-06
303,Bl2,Bl2-5,Private,Private,06.03.2019 17:38,17,06.03.2019 18:18,18,2.36,0.666111111,Mar,Wednesday,late afternoon (15-18),Less than 3 hours,2019-03-06 17:38:00,2019-03-06 18:18:00,0.6666666666666666,2019-03-06
304,Bl2,Bl2-1,Private,Private,06.03.2019 17:47,17,07.03.2019 11:44,11,11.61,17.93555556,Mar,Wednesday,late afternoon (15-18),Between 15 and 18 hours,2019-03-06 17:47:00,2019-03-07 11:44:00,17.95,2019-03-06
305,AdO1,AdO1-3,Private,Private,06.03.2019 18:20,18,06.03.2019 18:46,18,1.5,0.433888889,Mar,Wednesday,early evening (18-21),Less than 3 hours,2019-03-06 18:20:00,2019-03-06 18:46:00,0.43333333333333335,2019-03-06
306,AsO2,AsO2-1,Private,Private,06.03.2019 18:42,18,12.03.2019 06:58,6,13.95,132.2583333,Mar,Wednesday,early evening (18-21),More than 18 hours,2019-03-06 18:42:00,2019-03-12 06:58:00,132.26666666666668,2019-03-06
307,AdO1,AdO1-2,Private,Private,06.03.2019 18:46,18,07.03.2019 09:59,9,3.97,15.22111111,Mar,Wednesday,early evening (18-21),Between 15 and 18 hours,2019-03-06 18:46:00,2019-03-07 09:59:00,15.216666666666667,2019-03-06
308,Bl2,Bl2-5,Private,Private,06.03.2019 18:59,18,06.03.2019 20:22,20,4.94,1.389444444,Mar,Wednesday,early evening (18-21),Less than 3 hours,2019-03-06 18:59:00,2019-03-06 20:22:00,1.3833333333333333,2019-03-06
309,UT9,Share-12,Shared,Shared-12,06.03.2019 19:19,19,07.03.2019 08:08,8,25.68,12.80833333,Mar,Wednesday,early evening (18-21),Between 12 and 15 hours,2019-03-06 19:19:00,2019-03-07 08:08:00,12.816666666666666,2019-03-06
310,Bl2,Bl2-2,Private,Private,06.03.2019 20:00,20,07.03.2019 12:40,12,11.57,16.66805556,Mar,Wednesday,early evening (18-21),Between 15 and 18 hours,2019-03-06 20:00:00,2019-03-07 12:40:00,16.666666666666668,2019-03-06
311,Bl2,Bl2-5,Private,Private,06.03.2019 20:58,20,06.03.2019 21:23,21,1.49,0.423888889,Mar,Wednesday,early evening (18-21),Less than 3 hours,2019-03-06 20:58:00,2019-03-06 21:23:00,0.4166666666666667,2019-03-06
312,AdO1,AdO1-3,Private,Private,06.03.2019 21:09,21,07.03.2019 09:57,9,10.54,12.795,Mar,Wednesday,late evening (21-midnight),Between 12 and 15 hours,2019-03-06 21:09:00,2019-03-07 09:57:00,12.8,2019-03-06
313,AdO1,AdO1-1,Private,Private,06.03.2019 21:51,21,07.03.2019 06:29,6,13.29,8.639722222,Mar,Wednesday,late evening (21-midnight),Between 6 and 9  hours,2019-03-06 21:51:00,2019-03-07 06:29:00,8.633333333333333,2019-03-06
314,AsO2,Share-4,Shared,Shared-5,07.03.2019 10:11,10,07.03.2019 15:31,15,6.95,5.341111111,Mar,Thursday,late morning (9-12),Between 3 and 6 hours,2019-03-07 10:11:00,2019-03-07 15:31:00,5.333333333333333,2019-03-07
315,Bl2,Bl2-6,Private,Private,07.03.2019 11:41,11,07.03.2019 17:19,17,12.99,5.63,Mar,Thursday,late morning (9-12),Between 3 and 6 hours,2019-03-07 11:41:00,2019-03-07 17:19:00,5.633333333333334,2019-03-07
316,Bl2,Bl2-5,Private,Private,07.03.2019 15:55,15,07.03.2019 17:41,17,6.26,1.760833333,Mar,Thursday,late afternoon (15-18),Less than 3 hours,2019-03-07 15:55:00,2019-03-07 17:41:00,1.7666666666666666,2019-03-07
317,Bl2,Share-8,Shared,Shared-6,07.03.2019 17:47,17,07.03.2019 22:18,22,14.46,4.528055556,Mar,Thursday,late afternoon (15-18),Between 3 and 6 hours,2019-03-07 17:47:00,2019-03-07 22:18:00,4.516666666666667,2019-03-07
318,AdO3,AdO3-3,Private,Private,07.03.2019 18:22,18,08.03.2019 14:56,14,15.29,20.57194444,Mar,Thursday,early evening (18-21),More than 18 hours,2019-03-07 18:22:00,2019-03-08 14:56:00,20.566666666666666,2019-03-07
319,UT9,Share-14,Shared,Shared-12,07.03.2019 18:45,18,07.03.2019 21:52,21,11.51,3.107777778,Mar,Thursday,early evening (18-21),Between 3 and 6 hours,2019-03-07 18:45:00,2019-03-07 21:52:00,3.1166666666666667,2019-03-07
320,Bl2,Bl2-1,Private,Private,07.03.2019 19:18,19,08.03.2019 07:34,7,11.96,12.27416667,Mar,Thursday,early evening (18-21),Between 12 and 15 hours,2019-03-07 19:18:00,2019-03-08 07:34:00,12.266666666666667,2019-03-07
321,AdO1,AdO1-3,Private,Private,07.03.2019 19:21,19,08.03.2019 07:23,7,19.5,12.03111111,Mar,Thursday,early evening (18-21),Between 12 and 15 hours,2019-03-07 19:21:00,2019-03-08 07:23:00,12.033333333333333,2019-03-07
322,AdO3,AdO3-2,Private,Private,07.03.2019 19:43,19,08.03.2019 11:24,11,8.52,15.68333333,Mar,Thursday,early evening (18-21),Between 15 and 18 hours,2019-03-07 19:43:00,2019-03-08 11:24:00,15.683333333333334,2019-03-07
323,Bl2,Bl2-2,Private,Private,07.03.2019 20:15,20,08.03.2019 09:30,9,7.24,13.24555556,Mar,Thursday,early evening (18-21),Between 12 and 15 hours,2019-03-07 20:15:00,2019-03-08 09:30:00,13.25,2019-03-07
324,Bl2,Bl2-4,Private,Private,07.03.2019 21:14,21,08.03.2019 13:48,13,17.71,16.57472222,Mar,Thursday,late evening (21-midnight),Between 15 and 18 hours,2019-03-07 21:14:00,2019-03-08 13:48:00,16.566666666666666,2019-03-07
325,Bl2,Bl2-5,Private,Private,07.03.2019 21:23,21,08.03.2019 07:16,7,10.25,9.880555556,Mar,Thursday,late evening (21-midnight),Between 9 and 12 hours,2019-03-07 21:23:00,2019-03-08 07:16:00,9.883333333333333,2019-03-07
326,AdO3,AdO3-2,Private,Private,08.03.2019 14:21,14,08.03.2019 17:41,17,8.39,3.334444444,Mar,Friday,early afternoon (12-15),Between 3 and 6 hours,2019-03-08 14:21:00,2019-03-08 17:41:00,3.3333333333333335,2019-03-08
327,UT9,Share-12,Shared,Shared-12,08.03.2019 15:37,15,08.03.2019 17:14,17,9.96,1.620833333,Mar,Friday,late afternoon (15-18),Less than 3 hours,2019-03-08 15:37:00,2019-03-08 17:14:00,1.6166666666666667,2019-03-08
328,AdO1,AdO1-3,Private,Private,08.03.2019 16:26,16,11.03.2019 07:23,7,18.28,62.94527778,Mar,Friday,late afternoon (15-18),More than 18 hours,2019-03-08 16:26:00,2019-03-11 07:23:00,62.95,2019-03-08
329,Bl2,Bl2-5,Private,Private,08.03.2019 16:45,16,10.03.2019 20:07,20,9.85,51.36,Mar,Friday,late afternoon (15-18),More than 18 hours,2019-03-08 16:45:00,2019-03-10 20:07:00,51.36666666666667,2019-03-08
330,AdO3,AdO3-2,Private,Private,08.03.2019 18:10,18,09.03.2019 15:16,15,3.48,21.1075,Mar,Friday,early evening (18-21),More than 18 hours,2019-03-08 18:10:00,2019-03-09 15:16:00,21.1,2019-03-08
331,Bl2,Bl2-2,Private,Private,08.03.2019 18:29,18,09.03.2019 10:05,10,12.69,15.60805556,Mar,Friday,early evening (18-21),Between 15 and 18 hours,2019-03-08 18:29:00,2019-03-09 10:05:00,15.6,2019-03-08
332,Bl2,Bl2-4,Private,Private,08.03.2019 20:08,20,09.03.2019 22:45,22,19.53,26.61944444,Mar,Friday,early evening (18-21),More than 18 hours,2019-03-08 20:08:00,2019-03-09 22:45:00,26.616666666666667,2019-03-08
333,AdO1,AdO1-1,Private,Private,09.03.2019 14:24,14,10.03.2019 14:04,14,20.41,23.65638889,Mar,Saturday,early afternoon (12-15),More than 18 hours,2019-03-09 14:24:00,2019-03-10 14:04:00,23.666666666666668,2019-03-09
334,AdO1,AdO1-2,Private,Private,09.03.2019 15:46,15,09.03.2019 18:23,18,7.68,2.613055556,Mar,Saturday,late afternoon (15-18),Less than 3 hours,2019-03-09 15:46:00,2019-03-09 18:23:00,2.6166666666666667,2019-03-09
335,Bl2,Bl2-2,Private,Private,09.03.2019 17:52,17,10.03.2019 13:22,13,18.83,19.50444444,Mar,Saturday,late afternoon (15-18),More than 18 hours,2019-03-09 17:52:00,2019-03-10 13:22:00,19.5,2019-03-09
336,AdO3,AdO3-2,Private,Private,09.03.2019 17:59,17,10.03.2019 14:21,14,6.67,20.36138889,Mar,Saturday,late afternoon (15-18),More than 18 hours,2019-03-09 17:59:00,2019-03-10 14:21:00,20.366666666666667,2019-03-09
337,Bl2,Bl2-1,Private,Private,09.03.2019 21:00,21,10.03.2019 06:53,6,11.42,9.8775,Mar,Saturday,late evening (21-midnight),Between 9 and 12 hours,2019-03-09 21:00:00,2019-03-10 06:53:00,9.883333333333333,2019-03-09
338,AdO1,AdO1-2,Private,Private,09.03.2019 21:25,21,10.03.2019 13:08,13,6.25,15.71638889,Mar,Saturday,late evening (21-midnight),Between 15 and 18 hours,2019-03-09 21:25:00,2019-03-10 13:08:00,15.716666666666667,2019-03-09
339,AdO1,AdO1-2,Private,Private,10.03.2019 15:52,15,10.03.2019 17:34,17,4.34,1.690555556,Mar,Sunday,late afternoon (15-18),Less than 3 hours,2019-03-10 15:52:00,2019-03-10 17:34:00,1.7,2019-03-10
340,UT9,Share-6,Shared,Shared-12,10.03.2019 17:35,17,10.03.2019 21:37,21,24.6,4.031944444,Mar,Sunday,late afternoon (15-18),Between 3 and 6 hours,2019-03-10 17:35:00,2019-03-10 21:37:00,4.033333333333333,2019-03-10
341,AdO1,AdO1-2,Private,Private,10.03.2019 20:14,20,11.03.2019 10:50,10,4.47,14.61166667,Mar,Sunday,early evening (18-21),Between 12 and 15 hours,2019-03-10 20:14:00,2019-03-11 10:50:00,14.6,2019-03-10
342,Bl2,Bl2-5,Private,Private,10.03.2019 21:18,21,11.03.2019 06:50,6,9.96,9.531944444,Mar,Sunday,late evening (21-midnight),Between 9 and 12 hours,2019-03-10 21:18:00,2019-03-11 06:50:00,9.533333333333333,2019-03-10
343,AdO1,AdO1-3,Private,Private,11.03.2019 11:37,11,11.03.2019 17:31,17,19.5,5.896666667,Mar,Monday,late morning (9-12),Between 3 and 6 hours,2019-03-11 11:37:00,2019-03-11 17:31:00,5.9,2019-03-11
344,AdO3,AdO3-2,Private,Private,11.03.2019 15:30,15,11.03.2019 17:57,17,8.94,2.457222222,Mar,Monday,late afternoon (15-18),Less than 3 hours,2019-03-11 15:30:00,2019-03-11 17:57:00,2.45,2019-03-11
345,Bl2,Bl2-5,Private,Private,11.03.2019 15:55,15,11.03.2019 16:45,16,2.94,0.827222222,Mar,Monday,late afternoon (15-18),Less than 3 hours,2019-03-11 15:55:00,2019-03-11 16:45:00,0.8333333333333334,2019-03-11
346,Bl2,Bl2-1,Private,Private,11.03.2019 19:59,19,12.03.2019 08:52,8,17.61,12.88361111,Mar,Monday,early evening (18-21),Between 12 and 15 hours,2019-03-11 19:59:00,2019-03-12 08:52:00,12.883333333333333,2019-03-11
347,AdO1,AdO1-1,Private,Private,11.03.2019 20:28,20,12.03.2019 06:32,6,14.54,10.06444444,Mar,Monday,early evening (18-21),Between 9 and 12 hours,2019-03-11 20:28:00,2019-03-12 06:32:00,10.066666666666666,2019-03-11
348,AdO1,AdO1-2,Private,Private,11.03.2019 20:34,20,12.03.2019 11:00,11,6.46,14.44361111,Mar,Monday,early evening (18-21),Between 12 and 15 hours,2019-03-11 20:34:00,2019-03-12 11:00:00,14.433333333333334,2019-03-11
349,AdO3,AdO3-2,Private,Private,11.03.2019 20:34,20,12.03.2019 13:16,13,9.73,16.69833333,Mar,Monday,early evening (18-21),Between 15 and 18 hours,2019-03-11 20:34:00,2019-03-12 13:16:00,16.7,2019-03-11
350,UT9,Share-12,Shared,Shared-12,11.03.2019 21:01,21,12.03.2019 07:39,7,26.25,10.63805556,Mar,Monday,late evening (21-midnight),Between 9 and 12 hours,2019-03-11 21:01:00,2019-03-12 07:39:00,10.633333333333333,2019-03-11
351,Bl2,Share-8,Shared,Shared-6,11.03.2019 22:05,22,12.03.2019 10:20,10,21.95,12.24972222,Mar,Monday,late evening (21-midnight),Between 12 and 15 hours,2019-03-11 22:05:00,2019-03-12 10:20:00,12.25,2019-03-11
352,Bl2,Bl2-5,Private,Private,11.03.2019 22:11,22,12.03.2019 07:05,7,12.92,8.91,Mar,Monday,late evening (21-midnight),Between 6 and 9  hours,2019-03-11 22:11:00,2019-03-12 07:05:00,8.9,2019-03-11
353,AdO3,AdO3-3,Private,Private,11.03.2019 23:34,23,12.03.2019 15:01,15,16.01,15.45805556,Mar,Monday,late evening (21-midnight),Between 15 and 18 hours,2019-03-11 23:34:00,2019-03-12 15:01:00,15.45,2019-03-11
354,UT9,Share-6,Shared,Shared-12,12.03.2019 13:58,13,12.03.2019 18:43,18,22.91,4.753611111,Mar,Tuesday,early afternoon (12-15),Between 3 and 6 hours,2019-03-12 13:58:00,2019-03-12 18:43:00,4.75,2019-03-12
355,Bl2,Bl2-2,Private,Private,12.03.2019 14:49,14,12.03.2019 19:38,19,13.46,4.813611111,Mar,Tuesday,early afternoon (12-15),Between 3 and 6 hours,2019-03-12 14:49:00,2019-03-12 19:38:00,4.816666666666666,2019-03-12
356,AsO2,AsO2-1,Private,Private,12.03.2019 16:09,16,13.03.2019 07:19,7,12.23,15.17194444,Mar,Tuesday,late afternoon (15-18),Between 15 and 18 hours,2019-03-12 16:09:00,2019-03-13 07:19:00,15.166666666666666,2019-03-12
357,Bl2,Bl2-1,Private,Private,12.03.2019 17:09,17,12.03.2019 18:55,18,6.28,1.762222222,Mar,Tuesday,late afternoon (15-18),Less than 3 hours,2019-03-12 17:09:00,2019-03-12 18:55:00,1.7666666666666666,2019-03-12
358,AdO1,AdO1-2,Private,Private,12.03.2019 18:48,18,13.03.2019 10:15,10,6.91,15.45333333,Mar,Tuesday,early evening (18-21),Between 15 and 18 hours,2019-03-12 18:48:00,2019-03-13 10:15:00,15.45,2019-03-12
359,Bl2,Bl2-5,Private,Private,12.03.2019 18:49,18,12.03.2019 19:13,19,1.38,0.391388889,Mar,Tuesday,early evening (18-21),Less than 3 hours,2019-03-12 18:49:00,2019-03-12 19:13:00,0.4,2019-03-12
360,Bl2,Bl2-5,Private,Private,12.03.2019 21:18,21,13.03.2019 07:04,7,13.18,9.76,Mar,Tuesday,late evening (21-midnight),Between 9 and 12 hours,2019-03-12 21:18:00,2019-03-13 07:04:00,9.766666666666667,2019-03-12
361,AdO1,AdO1-1,Private,Private,12.03.2019 21:36,21,13.03.2019 06:39,6,15.31,9.041111111,Mar,Tuesday,late evening (21-midnight),Between 9 and 12 hours,2019-03-12 21:36:00,2019-03-13 06:39:00,9.05,2019-03-12
362,AsO2,Share-4,Shared,Shared-5,13.03.2019 12:50,12,13.03.2019 14:32,14,5.84,1.712777778,Mar,Wednesday,early afternoon (12-15),Less than 3 hours,2019-03-13 12:50:00,2019-03-13 14:32:00,1.7,2019-03-13
363,Bl2,Bl2-1,Private,Private,13.03.2019 13:33,13,13.03.2019 14:15,14,2.54,0.711944444,Mar,Wednesday,early afternoon (12-15),Less than 3 hours,2019-03-13 13:33:00,2019-03-13 14:15:00,0.7,2019-03-13
364,AdO1,AdO1-2,Private,Private,13.03.2019 13:41,13,13.03.2019 18:31,18,5.28,4.835,Mar,Wednesday,early afternoon (12-15),Between 3 and 6 hours,2019-03-13 13:41:00,2019-03-13 18:31:00,4.833333333333333,2019-03-13
365,AdO3,AdO3-2,Private,Private,13.03.2019 13:54,13,14.03.2019 07:13,7,8.42,17.31138889,Mar,Wednesday,early afternoon (12-15),Between 15 and 18 hours,2019-03-13 13:54:00,2019-03-14 07:13:00,17.316666666666666,2019-03-13
366,Bl2,Bl2-1,Private,Private,13.03.2019 14:44,14,13.03.2019 16:10,16,5.1,1.421388889,Mar,Wednesday,early afternoon (12-15),Less than 3 hours,2019-03-13 14:44:00,2019-03-13 16:10:00,1.4333333333333333,2019-03-13
367,Bl2,Bl2-5,Private,Private,13.03.2019 16:15,16,13.03.2019 16:48,16,1.91,0.541111111,Mar,Wednesday,late afternoon (15-18),Less than 3 hours,2019-03-13 16:15:00,2019-03-13 16:48:00,0.55,2019-03-13
368,Bl2,Bl2-5,Private,Private,13.03.2019 17:21,17,13.03.2019 17:52,17,1.83,0.515833333,Mar,Wednesday,late afternoon (15-18),Less than 3 hours,2019-03-13 17:21:00,2019-03-13 17:52:00,0.5166666666666667,2019-03-13
369,Bl2,Bl2-1,Private,Private,13.03.2019 17:46,17,13.03.2019 20:35,20,10.08,2.812777778,Mar,Wednesday,late afternoon (15-18),Less than 3 hours,2019-03-13 17:46:00,2019-03-13 20:35:00,2.816666666666667,2019-03-13
370,AdO1,AdO1-2,Private,Private,13.03.2019 20:11,20,14.03.2019 08:09,8,3.53,11.97111111,Mar,Wednesday,early evening (18-21),Between 9 and 12 hours,2019-03-13 20:11:00,2019-03-14 08:09:00,11.966666666666667,2019-03-13
371,AsO2,AsO2-1,Private,Private,13.03.2019 20:15,20,15.03.2019 07:21,7,14.67,35.10194444,Mar,Wednesday,early evening (18-21),More than 18 hours,2019-03-13 20:15:00,2019-03-15 07:21:00,35.1,2019-03-13
372,Bl2,Share-8,Shared,Shared-6,13.03.2019 22:11,22,14.03.2019 10:07,10,22.06,11.92166667,Mar,Wednesday,late evening (21-midnight),Between 9 and 12 hours,2019-03-13 22:11:00,2019-03-14 10:07:00,11.933333333333334,2019-03-13
373,Bl2,Bl2-2,Private,Private,13.03.2019 22:12,22,14.03.2019 08:30,8,13.83,10.29861111,Mar,Wednesday,late evening (21-midnight),Between 9 and 12 hours,2019-03-13 22:12:00,2019-03-14 08:30:00,10.3,2019-03-13
374,Bl2,Bl2-5,Private,Private,13.03.2019 22:33,22,14.03.2019 07:10,7,19.5,8.615833333,Mar,Wednesday,late evening (21-midnight),Between 6 and 9  hours,2019-03-13 22:33:00,2019-03-14 07:10:00,8.616666666666667,2019-03-13
375,Bl2,Bl2-6,Private,Private,14.03.2019 13:53,13,16.03.2019 11:32,11,11.77,45.66027778,Mar,Thursday,early afternoon (12-15),More than 18 hours,2019-03-14 13:53:00,2019-03-16 11:32:00,45.65,2019-03-14
376,Bl2,Bl2-1,Private,Private,14.03.2019 15:23,15,14.03.2019 17:27,17,7.37,2.057222222,Mar,Thursday,late afternoon (15-18),Less than 3 hours,2019-03-14 15:23:00,2019-03-14 17:27:00,2.066666666666667,2019-03-14
377,Bl2,Bl2-5,Private,Private,14.03.2019 17:03,17,14.03.2019 18:06,18,3.72,1.050277778,Mar,Thursday,late afternoon (15-18),Less than 3 hours,2019-03-14 17:03:00,2019-03-14 18:06:00,1.05,2019-03-14
378,Bl2,Bl2-3,Private,Private,14.03.2019 17:06,17,15.03.2019 07:42,7,43.07,14.59027778,Mar,Thursday,late afternoon (15-18),Between 12 and 15 hours,2019-03-14 17:06:00,2019-03-15 07:42:00,14.6,2019-03-14
379,Bl2,Bl2-1,Private,Private,14.03.2019 18:59,18,14.03.2019 21:26,21,7.58,2.439722222,Mar,Thursday,early evening (18-21),Less than 3 hours,2019-03-14 18:59:00,2019-03-14 21:26:00,2.45,2019-03-14
380,AdO1,AdO1-3,Private,Private,14.03.2019 19:40,19,15.03.2019 09:48,9,11.74,14.12916667,Mar,Thursday,early evening (18-21),Between 12 and 15 hours,2019-03-14 19:40:00,2019-03-15 09:48:00,14.133333333333333,2019-03-14
381,UT9,Share-12,Shared,Shared-12,14.03.2019 20:01,20,15.03.2019 07:24,7,26.24,11.38055556,Mar,Thursday,early evening (18-21),Between 9 and 12 hours,2019-03-14 20:01:00,2019-03-15 07:24:00,11.383333333333333,2019-03-14
382,Bl2,Bl2-5,Private,Private,14.03.2019 21:10,21,15.03.2019 07:11,7,12.24,10.00888889,Mar,Thursday,late evening (21-midnight),Between 9 and 12 hours,2019-03-14 21:10:00,2019-03-15 07:11:00,10.016666666666667,2019-03-14
383,AdO1,AdO1-1,Private,Private,14.03.2019 21:31,21,15.03.2019 06:27,6,12.25,8.946111111,Mar,Thursday,late evening (21-midnight),Between 6 and 9  hours,2019-03-14 21:31:00,2019-03-15 06:27:00,8.933333333333334,2019-03-14
384,AdO3,AdO3-4,Private,Private,14.03.2019 23:33,23,15.03.2019 10:24,10,38.23,10.86083333,Mar,Thursday,late evening (21-midnight),Between 9 and 12 hours,2019-03-14 23:33:00,2019-03-15 10:24:00,10.85,2019-03-14
385,AsO2,Share-4,Shared,Shared-5,15.03.2019 11:01,11,15.03.2019 14:54,14,6.2,3.872777778,Mar,Friday,late morning (9-12),Between 3 and 6 hours,2019-03-15 11:01:00,2019-03-15 14:54:00,3.8833333333333333,2019-03-15
386,AdO3,AdO3-2,Private,Private,15.03.2019 14:36,14,16.03.2019 15:02,15,7.78,24.43333333,Mar,Friday,early afternoon (12-15),More than 18 hours,2019-03-15 14:36:00,2019-03-16 15:02:00,24.433333333333334,2019-03-15
387,Bl2,Bl2-3,Private,Private,15.03.2019 16:09,16,16.03.2019 14:21,14,3.56,22.20722222,Mar,Friday,late afternoon (15-18),More than 18 hours,2019-03-15 16:09:00,2019-03-16 14:21:00,22.2,2019-03-15
388,Bl2,Bl2-5,Private,Private,15.03.2019 16:20,16,15.03.2019 19:00,19,5.43,2.665277778,Mar,Friday,late afternoon (15-18),Less than 3 hours,2019-03-15 16:20:00,2019-03-15 19:00:00,2.6666666666666665,2019-03-15
389,Bl2,Bl2-2,Private,Private,15.03.2019 17:58,17,15.03.2019 19:03,19,3.89,1.086111111,Mar,Friday,late afternoon (15-18),Less than 3 hours,2019-03-15 17:58:00,2019-03-15 19:03:00,1.0833333333333333,2019-03-15
390,AdO1,AdO1-2,Private,Private,15.03.2019 19:22,19,16.03.2019 14:02,14,9.53,18.66638889,Mar,Friday,early evening (18-21),More than 18 hours,2019-03-15 19:22:00,2019-03-16 14:02:00,18.666666666666668,2019-03-15
391,Bl2,Bl2-5,Private,Private,15.03.2019 19:37,19,15.03.2019 19:46,19,0.54,0.157777778,Mar,Friday,early evening (18-21),Less than 3 hours,2019-03-15 19:37:00,2019-03-15 19:46:00,0.15,2019-03-15
392,Bl2,Bl2-5,Private,Private,15.03.2019 19:55,19,16.03.2019 11:54,11,5.12,15.97944444,Mar,Friday,early evening (18-21),Between 15 and 18 hours,2019-03-15 19:55:00,2019-03-16 11:54:00,15.983333333333333,2019-03-15
393,AdO1,AdO1-3,Private,Private,15.03.2019 21:09,21,16.03.2019 16:51,16,8.6,19.70388889,Mar,Friday,late evening (21-midnight),More than 18 hours,2019-03-15 21:09:00,2019-03-16 16:51:00,19.7,2019-03-15
394,Bl2,Bl2-4,Private,Private,15.03.2019 21:56,21,16.03.2019 14:17,14,24.71,16.36027778,Mar,Friday,late evening (21-midnight),Between 15 and 18 hours,2019-03-15 21:56:00,2019-03-16 14:17:00,16.35,2019-03-15
395,UT9,Share-14,Shared,Shared-12,15.03.2019 22:34,22,16.03.2019 10:19,10,16.87,11.75277778,Mar,Friday,late evening (21-midnight),Between 9 and 12 hours,2019-03-15 22:34:00,2019-03-16 10:19:00,11.75,2019-03-15
396,Bl2,Bl2-2,Private,Private,16.03.2019 11:40,11,16.03.2019 13:54,13,8.01,2.230277778,Mar,Saturday,late morning (9-12),Less than 3 hours,2019-03-16 11:40:00,2019-03-16 13:54:00,2.2333333333333334,2019-03-16
397,AsO2,AsO2-1,Private,Private,16.03.2019 14:55,14,18.03.2019 07:16,7,16.9,40.33861111,Mar,Saturday,early afternoon (12-15),More than 18 hours,2019-03-16 14:55:00,2019-03-18 07:16:00,40.35,2019-03-16
398,Bl2,Bl2-5,Private,Private,16.03.2019 15:23,15,16.03.2019 17:18,17,5.67,1.906944444,Mar,Saturday,late afternoon (15-18),Less than 3 hours,2019-03-16 15:23:00,2019-03-16 17:18:00,1.9166666666666667,2019-03-16
399,Bl2,Bl2-1,Private,Private,16.03.2019 15:24,15,16.03.2019 16:04,16,2.43,0.681111111,Mar,Saturday,late afternoon (15-18),Less than 3 hours,2019-03-16 15:24:00,2019-03-16 16:04:00,0.6666666666666666,2019-03-16
400,AdO1,AdO1-2,Private,Private,16.03.2019 15:32,15,16.03.2019 19:09,19,3.52,3.605277778,Mar,Saturday,late afternoon (15-18),Between 3 and 6 hours,2019-03-16 15:32:00,2019-03-16 19:09:00,3.6166666666666667,2019-03-16
401,Bl2,Bl2-3,Private,Private,16.03.2019 17:05,17,17.03.2019 11:38,11,14.57,18.555,Mar,Saturday,late afternoon (15-18),More than 18 hours,2019-03-16 17:05:00,2019-03-17 11:38:00,18.55,2019-03-16
402,AdO3,AdO3-2,Private,Private,16.03.2019 17:18,17,16.03.2019 19:10,19,6.36,1.872777778,Mar,Saturday,late afternoon (15-18),Less than 3 hours,2019-03-16 17:18:00,2019-03-16 19:10:00,1.8666666666666667,2019-03-16
403,Bl2,Bl2-1,Private,Private,16.03.2019 17:28,17,16.03.2019 20:38,20,11.39,3.162777778,Mar,Saturday,late afternoon (15-18),Between 3 and 6 hours,2019-03-16 17:28:00,2019-03-16 20:38:00,3.1666666666666665,2019-03-16
404,AdO1,AdO1-3,Private,Private,16.03.2019 17:42,17,16.03.2019 19:42,19,4.29,1.988611111,Mar,Saturday,late afternoon (15-18),Less than 3 hours,2019-03-16 17:42:00,2019-03-16 19:42:00,2.0,2019-03-16
405,AdO3,AdO3-3,Private,Private,16.03.2019 19:34,19,18.03.2019 07:32,7,23.08,35.96972222,Mar,Saturday,early evening (18-21),More than 18 hours,2019-03-16 19:34:00,2019-03-18 07:32:00,35.96666666666667,2019-03-16
406,AdO3,AdO3-2,Private,Private,16.03.2019 19:40,19,16.03.2019 21:11,21,5.69,1.526111111,Mar,Saturday,early evening (18-21),Less than 3 hours,2019-03-16 19:40:00,2019-03-16 21:11:00,1.5166666666666666,2019-03-16
407,AdO1,AdO1-3,Private,Private,16.03.2019 20:02,20,17.03.2019 16:57,16,2.41,20.91861111,Mar,Saturday,early evening (18-21),More than 18 hours,2019-03-16 20:02:00,2019-03-17 16:57:00,20.916666666666668,2019-03-16
408,UT9,Share-6,Shared,Shared-12,16.03.2019 23:31,23,17.03.2019 09:42,9,27.39,10.19666667,Mar,Saturday,late evening (21-midnight),Between 9 and 12 hours,2019-03-16 23:31:00,2019-03-17 09:42:00,10.183333333333334,2019-03-16
409,Bl2,Bl2-5,Private,Private,17.03.2019 00:34,0,17.03.2019 10:33,10,17.44,9.988055556,Mar,Sunday,early night (midnight-3),Between 9 and 12 hours,2019-03-17 00:34:00,2019-03-17 10:33:00,9.983333333333333,2019-03-17
410,AdO1,AdO1-2,Private,Private,17.03.2019 00:35,0,17.03.2019 12:49,12,3.75,12.22472222,Mar,Sunday,early night (midnight-3),Between 12 and 15 hours,2019-03-17 00:35:00,2019-03-17 12:49:00,12.233333333333333,2019-03-17
411,AdO3,AdO3-2,Private,Private,17.03.2019 01:14,1,17.03.2019 14:54,14,16.02,13.665,Mar,Sunday,early night (midnight-3),Between 12 and 15 hours,2019-03-17 01:14:00,2019-03-17 14:54:00,13.666666666666666,2019-03-17
412,AdO1,AdO1-1,Private,Private,17.03.2019 06:51,6,17.03.2019 19:12,19,17.0,12.34861111,Mar,Sunday,early morning (6-9),Between 12 and 15 hours,2019-03-17 06:51:00,2019-03-17 19:12:00,12.35,2019-03-17
413,AsO2,Share-4,Shared,Shared-5,17.03.2019 10:55,10,17.03.2019 18:49,18,7.63,7.896666667,Mar,Sunday,late morning (9-12),Between 6 and 9  hours,2019-03-17 10:55:00,2019-03-17 18:49:00,7.9,2019-03-17
414,Bl2,Bl2-1,Private,Private,17.03.2019 14:14,14,18.03.2019 08:03,8,11.2,17.82027778,Mar,Sunday,early afternoon (12-15),Between 15 and 18 hours,2019-03-17 14:14:00,2019-03-18 08:03:00,17.816666666666666,2019-03-17
415,Bl2,Bl2-2,Private,Private,17.03.2019 18:44,18,18.03.2019 09:24,9,15.28,14.66861111,Mar,Sunday,early evening (18-21),Between 12 and 15 hours,2019-03-17 18:44:00,2019-03-18 09:24:00,14.666666666666666,2019-03-17
416,Bl2,Bl2-5,Private,Private,17.03.2019 18:55,18,18.03.2019 07:12,7,13.72,12.28472222,Mar,Sunday,early evening (18-21),Between 12 and 15 hours,2019-03-17 18:55:00,2019-03-18 07:12:00,12.283333333333333,2019-03-17
417,UT9,Share-12,Shared,Shared-12,17.03.2019 19:43,19,18.03.2019 06:14,6,19.94,10.50333333,Mar,Sunday,early evening (18-21),Between 9 and 12 hours,2019-03-17 19:43:00,2019-03-18 06:14:00,10.516666666666667,2019-03-17
418,AdO1,AdO1-2,Private,Private,17.03.2019 19:52,19,18.03.2019 09:59,9,8.36,14.11611111,Mar,Sunday,early evening (18-21),Between 12 and 15 hours,2019-03-17 19:52:00,2019-03-18 09:59:00,14.116666666666667,2019-03-17
419,Bl2,Bl2-2,Private,Private,18.03.2019 13:42,13,18.03.2019 14:32,14,2.97,0.831388889,Mar,Monday,early afternoon (12-15),Less than 3 hours,2019-03-18 13:42:00,2019-03-18 14:32:00,0.8333333333333334,2019-03-18
420,Bl2,Bl2-5,Private,Private,18.03.2019 15:43,15,18.03.2019 16:18,16,2.1,0.593055556,Mar,Monday,late afternoon (15-18),Less than 3 hours,2019-03-18 15:43:00,2019-03-18 16:18:00,0.5833333333333334,2019-03-18
421,Bl2,Bl2-3,Private,Private,18.03.2019 16:10,16,19.03.2019 07:30,7,9.56,15.33972222,Mar,Monday,late afternoon (15-18),Between 15 and 18 hours,2019-03-18 16:10:00,2019-03-19 07:30:00,15.333333333333334,2019-03-18
422,AdO1,AdO1-3,Private,Private,18.03.2019 16:29,16,19.03.2019 12:53,12,19.59,20.39722222,Mar,Monday,late afternoon (15-18),More than 18 hours,2019-03-18 16:29:00,2019-03-19 12:53:00,20.4,2019-03-18
423,AsO2,AsO2-1,Private,Private,18.03.2019 17:53,17,19.03.2019 07:27,7,14.01,13.55666667,Mar,Monday,late afternoon (15-18),Between 12 and 15 hours,2019-03-18 17:53:00,2019-03-19 07:27:00,13.566666666666666,2019-03-18
424,AdO1,AdO1-2,Private,Private,18.03.2019 20:09,20,19.03.2019 10:01,10,5.53,13.85666667,Mar,Monday,early evening (18-21),Between 12 and 15 hours,2019-03-18 20:09:00,2019-03-19 10:01:00,13.866666666666667,2019-03-18
425,Bl2,Bl2-1,Private,Private,18.03.2019 20:43,20,19.03.2019 07:47,7,11.79,11.05916667,Mar,Monday,early evening (18-21),Between 9 and 12 hours,2019-03-18 20:43:00,2019-03-19 07:47:00,11.066666666666666,2019-03-18
426,Bl2,Bl2-5,Private,Private,18.03.2019 22:08,22,19.03.2019 08:08,8,8.39,10.01027778,Mar,Monday,late evening (21-midnight),Between 9 and 12 hours,2019-03-18 22:08:00,2019-03-19 08:08:00,10.0,2019-03-18
427,Bl2,Bl2-6,Private,Private,19.03.2019 09:38,9,20.03.2019 09:19,9,7.54,23.68861111,Mar,Tuesday,late morning (9-12),More than 18 hours,2019-03-19 09:38:00,2019-03-20 09:19:00,23.683333333333334,2019-03-19
428,Bl2,Bl2-5,Private,Private,19.03.2019 15:52,15,19.03.2019 16:31,16,2.34,0.659444444,Mar,Tuesday,late afternoon (15-18),Less than 3 hours,2019-03-19 15:52:00,2019-03-19 16:31:00,0.65,2019-03-19
429,Bl2,Bl2-3,Private,Private,19.03.2019 16:54,16,20.03.2019 07:46,7,14.12,14.85388889,Mar,Tuesday,late afternoon (15-18),Between 12 and 15 hours,2019-03-19 16:54:00,2019-03-20 07:46:00,14.866666666666667,2019-03-19
430,Bl2,Bl2-5,Private,Private,19.03.2019 17:26,17,19.03.2019 17:35,17,0.55,0.159166667,Mar,Tuesday,late afternoon (15-18),Less than 3 hours,2019-03-19 17:26:00,2019-03-19 17:35:00,0.15,2019-03-19
431,Bl2,Bl2-5,Private,Private,19.03.2019 19:10,19,19.03.2019 20:48,20,5.81,1.631388889,Mar,Tuesday,early evening (18-21),Less than 3 hours,2019-03-19 19:10:00,2019-03-19 20:48:00,1.6333333333333333,2019-03-19
432,AdO1,AdO1-1,Private,Private,19.03.2019 19:46,19,20.03.2019 15:04,15,20.57,19.29833333,Mar,Tuesday,early evening (18-21),More than 18 hours,2019-03-19 19:46:00,2019-03-20 15:04:00,19.3,2019-03-19
433,Bl2,Bl2-1,Private,Private,19.03.2019 20:36,20,19.03.2019 21:04,21,1.63,0.460833333,Mar,Tuesday,early evening (18-21),Less than 3 hours,2019-03-19 20:36:00,2019-03-19 21:04:00,0.4666666666666667,2019-03-19
434,Bl2,Bl2-5,Private,Private,19.03.2019 21:15,21,20.03.2019 07:04,7,12.46,9.818611111,Mar,Tuesday,late evening (21-midnight),Between 9 and 12 hours,2019-03-19 21:15:00,2019-03-20 07:04:00,9.816666666666666,2019-03-19
435,AdO1,AdO1-3,Private,Private,19.03.2019 21:23,21,20.03.2019 07:25,7,6.83,10.04083333,Mar,Tuesday,late evening (21-midnight),Between 9 and 12 hours,2019-03-19 21:23:00,2019-03-20 07:25:00,10.033333333333333,2019-03-19
436,AsO2,AsO2-1,Private,Private,19.03.2019 22:33,22,20.03.2019 07:06,7,12.78,8.561388889,Mar,Tuesday,late evening (21-midnight),Between 6 and 9  hours,2019-03-19 22:33:00,2019-03-20 07:06:00,8.55,2019-03-19
437,Bl2,Bl2-4,Private,Private,20.03.2019 00:54,0,20.03.2019 14:10,14,30.24,13.2675,Mar,Wednesday,early night (midnight-3),Between 12 and 15 hours,2019-03-20 00:54:00,2019-03-20 14:10:00,13.266666666666667,2019-03-20
438,Bl2,Bl2-1,Private,Private,20.03.2019 07:48,7,20.03.2019 08:35,8,2.78,0.779166667,Mar,Wednesday,early morning (6-9),Less than 3 hours,2019-03-20 07:48:00,2019-03-20 08:35:00,0.7833333333333333,2019-03-20
439,Bl2,Bl2-1,Private,Private,20.03.2019 14:50,14,21.03.2019 07:25,7,19.21,16.57666667,Mar,Wednesday,early afternoon (12-15),Between 15 and 18 hours,2019-03-20 14:50:00,2019-03-21 07:25:00,16.583333333333332,2019-03-20
440,Bl2,Bl2-2,Private,Private,20.03.2019 15:09,15,20.03.2019 19:05,19,13.21,3.931388889,Mar,Wednesday,late afternoon (15-18),Between 3 and 6 hours,2019-03-20 15:09:00,2019-03-20 19:05:00,3.933333333333333,2019-03-20
441,UT9,Share-12,Shared,Shared-12,20.03.2019 15:14,15,20.03.2019 16:24,16,7.18,1.171388889,Mar,Wednesday,late afternoon (15-18),Less than 3 hours,2019-03-20 15:14:00,2019-03-20 16:24:00,1.1666666666666667,2019-03-20
442,AdO1,AdO1-3,Private,Private,20.03.2019 16:15,16,21.03.2019 10:01,10,17.82,17.77,Mar,Wednesday,late afternoon (15-18),Between 15 and 18 hours,2019-03-20 16:15:00,2019-03-21 10:01:00,17.766666666666666,2019-03-20
443,Bl2,Bl2-5,Private,Private,20.03.2019 16:22,16,20.03.2019 16:49,16,1.6,0.4525,Mar,Wednesday,late afternoon (15-18),Less than 3 hours,2019-03-20 16:22:00,2019-03-20 16:49:00,0.45,2019-03-20
444,Bl2,Bl2-5,Private,Private,20.03.2019 17:27,17,20.03.2019 17:42,17,0.88,0.251666667,Mar,Wednesday,late afternoon (15-18),Less than 3 hours,2019-03-20 17:27:00,2019-03-20 17:42:00,0.25,2019-03-20
445,UT9,Share-12,Shared,Shared-12,20.03.2019 19:12,19,21.03.2019 07:16,7,26.14,12.05527778,Mar,Wednesday,early evening (18-21),Between 12 and 15 hours,2019-03-20 19:12:00,2019-03-21 07:16:00,12.066666666666666,2019-03-20
446,AsO2,AsO2-1,Private,Private,20.03.2019 20:20,20,21.03.2019 07:08,7,13.93,10.80166667,Mar,Wednesday,early evening (18-21),Between 9 and 12 hours,2019-03-20 20:20:00,2019-03-21 07:08:00,10.8,2019-03-20
447,Bl2,Bl2-3,Private,Private,20.03.2019 20:49,20,21.03.2019 07:46,7,22.53,10.94888889,Mar,Wednesday,early evening (18-21),Between 9 and 12 hours,2019-03-20 20:49:00,2019-03-21 07:46:00,10.95,2019-03-20
448,Bl2,Bl2-5,Private,Private,20.03.2019 21:47,21,21.03.2019 07:14,7,12.1,9.442777778,Mar,Wednesday,late evening (21-midnight),Between 9 and 12 hours,2019-03-20 21:47:00,2019-03-21 07:14:00,9.45,2019-03-20
449,AdO3,AdO3-2,Private,Private,21.03.2019 11:30,11,21.03.2019 12:58,12,5.49,1.470555556,Mar,Thursday,late morning (9-12),Less than 3 hours,2019-03-21 11:30:00,2019-03-21 12:58:00,1.4666666666666666,2019-03-21
450,Bl2,Share-8,Shared,Shared-6,21.03.2019 16:21,16,21.03.2019 22:15,22,31.57,5.9025,Mar,Thursday,late afternoon (15-18),Between 3 and 6 hours,2019-03-21 16:21:00,2019-03-21 22:15:00,5.9,2019-03-21
451,Bl2,Bl2-3,Private,Private,21.03.2019 16:28,16,22.03.2019 07:39,7,5.75,15.17972222,Mar,Thursday,late afternoon (15-18),Between 15 and 18 hours,2019-03-21 16:28:00,2019-03-22 07:39:00,15.183333333333334,2019-03-21
452,Bl2,Bl2-5,Private,Private,21.03.2019 16:48,16,21.03.2019 18:04,18,4.5,1.263055556,Mar,Thursday,late afternoon (15-18),Less than 3 hours,2019-03-21 16:48:00,2019-03-21 18:04:00,1.2666666666666666,2019-03-21
453,Bl2,Bl2-5,Private,Private,21.03.2019 18:58,18,22.03.2019 07:06,7,6.85,12.1425,Mar,Thursday,early evening (18-21),Between 12 and 15 hours,2019-03-21 18:58:00,2019-03-22 07:06:00,12.133333333333333,2019-03-21
454,AdO1,AdO1-3,Private,Private,21.03.2019 19:06,19,22.03.2019 07:24,7,17.59,12.295,Mar,Thursday,early evening (18-21),Between 12 and 15 hours,2019-03-21 19:06:00,2019-03-22 07:24:00,12.3,2019-03-21
455,Bl2,Bl2-1,Private,Private,21.03.2019 19:10,19,22.03.2019 08:07,8,10.21,12.95277778,Mar,Thursday,early evening (18-21),Between 12 and 15 hours,2019-03-21 19:10:00,2019-03-22 08:07:00,12.95,2019-03-21
456,Bl2,Bl2-4,Private,Private,21.03.2019 21:14,21,22.03.2019 11:46,11,23.18,14.53305556,Mar,Thursday,late evening (21-midnight),Between 12 and 15 hours,2019-03-21 21:14:00,2019-03-22 11:46:00,14.533333333333333,2019-03-21
457,AsO2,AsO2-1,Private,Private,21.03.2019 21:57,21,22.03.2019 06:49,6,13.41,8.876111111,Mar,Thursday,late evening (21-midnight),Between 6 and 9  hours,2019-03-21 21:57:00,2019-03-22 06:49:00,8.866666666666667,2019-03-21
458,UT9,Share-14,Shared,Shared-12,21.03.2019 22:02,22,22.03.2019 07:05,7,16.88,9.06,Mar,Thursday,late evening (21-midnight),Between 9 and 12 hours,2019-03-21 22:02:00,2019-03-22 07:05:00,9.05,2019-03-21
459,AdO1,AdO1-1,Private,Private,22.03.2019 06:54,6,22.03.2019 21:41,21,20.46,14.77638889,Mar,Friday,early morning (6-9),Between 12 and 15 hours,2019-03-22 06:54:00,2019-03-22 21:41:00,14.783333333333333,2019-03-22
460,AdO3,AdO3-2,Private,Private,22.03.2019 14:25,14,22.03.2019 22:12,22,11.22,7.783333333,Mar,Friday,early afternoon (12-15),Between 6 and 9  hours,2019-03-22 14:25:00,2019-03-22 22:12:00,7.783333333333333,2019-03-22
461,Bl2,Bl2-5,Private,Private,22.03.2019 14:25,14,22.03.2019 16:17,16,5.33,1.86,Mar,Friday,early afternoon (12-15),Less than 3 hours,2019-03-22 14:25:00,2019-03-22 16:17:00,1.8666666666666667,2019-03-22
462,AdO1,AdO1-3,Private,Private,22.03.2019 15:09,15,25.03.2019 07:23,7,16.37,64.22361111,Mar,Friday,late afternoon (15-18),More than 18 hours,2019-03-22 15:09:00,2019-03-25 07:23:00,64.23333333333333,2019-03-22
463,Bl2,Bl2-3,Private,Private,22.03.2019 15:12,15,23.03.2019 12:40,12,18.69,21.46805556,Mar,Friday,late afternoon (15-18),More than 18 hours,2019-03-22 15:12:00,2019-03-23 12:40:00,21.466666666666665,2019-03-22
464,Bl2,Bl2-2,Private,Private,22.03.2019 15:30,15,22.03.2019 20:04,20,14.36,4.573333333,Mar,Friday,late afternoon (15-18),Between 3 and 6 hours,2019-03-22 15:30:00,2019-03-22 20:04:00,4.566666666666666,2019-03-22
465,Bl2,Share-9,Shared,Shared-6,22.03.2019 19:31,19,23.03.2019 09:38,9,38.55,14.11166667,Mar,Friday,early evening (18-21),Between 12 and 15 hours,2019-03-22 19:31:00,2019-03-23 09:38:00,14.116666666666667,2019-03-22
466,Bl2,Bl2-6,Private,Private,22.03.2019 20:46,20,25.03.2019 10:14,10,18.88,61.45777778,Mar,Friday,early evening (18-21),More than 18 hours,2019-03-22 20:46:00,2019-03-25 10:14:00,61.46666666666667,2019-03-22
467,AdO3,AdO3-2,Private,Private,23.03.2019 00:01,0,23.03.2019 11:12,11,16.18,11.17777778,Mar,Saturday,early night (midnight-3),Between 9 and 12 hours,2019-03-23 00:01:00,2019-03-23 11:12:00,11.183333333333334,2019-03-23
468,AdO3,AdO3-3,Private,Private,23.03.2019 08:37,8,23.03.2019 10:21,10,6.15,1.724722222,Mar,Saturday,early morning (6-9),Less than 3 hours,2019-03-23 08:37:00,2019-03-23 10:21:00,1.7333333333333334,2019-03-23
469,Bl2,Bl2-1,Private,Private,23.03.2019 11:14,11,23.03.2019 17:35,17,17.16,6.342777778,Mar,Saturday,late morning (9-12),Between 6 and 9  hours,2019-03-23 11:14:00,2019-03-23 17:35:00,6.35,2019-03-23
470,AdO3,AdO3-2,Private,Private,23.03.2019 18:27,18,24.03.2019 17:19,17,12.09,22.87388889,Mar,Saturday,early evening (18-21),More than 18 hours,2019-03-23 18:27:00,2019-03-24 17:19:00,22.866666666666667,2019-03-23
471,AdO1,AdO1-1,Private,Private,23.03.2019 20:54,20,23.03.2019 21:50,21,3.37,0.933333333,Mar,Saturday,early evening (18-21),Less than 3 hours,2019-03-23 20:54:00,2019-03-23 21:50:00,0.9333333333333333,2019-03-23
472,AdO1,AdO1-1,Private,Private,24.03.2019 07:57,7,24.03.2019 15:57,15,15.92,8.001944444,Mar,Sunday,early morning (6-9),Between 6 and 9  hours,2019-03-24 07:57:00,2019-03-24 15:57:00,8.0,2019-03-24
473,Bl2,Share-9,Shared,Shared-6,24.03.2019 14:19,14,25.03.2019 09:54,9,14.99,19.58,Mar,Sunday,early afternoon (12-15),More than 18 hours,2019-03-24 14:19:00,2019-03-25 09:54:00,19.583333333333332,2019-03-24
474,UT9,Share-14,Shared,Shared-12,24.03.2019 14:55,14,24.03.2019 17:49,17,10.74,2.893333333,Mar,Sunday,early afternoon (12-15),Less than 3 hours,2019-03-24 14:55:00,2019-03-24 17:49:00,2.9,2019-03-24
475,Bl2,Bl2-5,Private,Private,24.03.2019 16:39,16,25.03.2019 07:03,7,18.06,14.40888889,Mar,Sunday,late afternoon (15-18),Between 12 and 15 hours,2019-03-24 16:39:00,2019-03-25 07:03:00,14.4,2019-03-24
476,AsO2,AsO2-1,Private,Private,24.03.2019 16:47,16,25.03.2019 07:01,7,12.67,14.23833333,Mar,Sunday,late afternoon (15-18),Between 12 and 15 hours,2019-03-24 16:47:00,2019-03-25 07:01:00,14.233333333333333,2019-03-24
477,AdO3,AdO3-3,Private,Private,24.03.2019 17:13,17,25.03.2019 07:38,7,26.52,14.41,Mar,Sunday,late afternoon (15-18),Between 12 and 15 hours,2019-03-24 17:13:00,2019-03-25 07:38:00,14.416666666666666,2019-03-24
478,UT9,Share-12,Shared,Shared-11,24.03.2019 17:17,17,24.03.2019 21:46,21,25.84,4.472777778,Mar,Sunday,late afternoon (15-18),Between 3 and 6 hours,2019-03-24 17:17:00,2019-03-24 21:46:00,4.483333333333333,2019-03-24
479,Bl2,Bl2-1,Private,Private,24.03.2019 21:10,21,25.03.2019 06:02,6,8.45,8.857777778,Mar,Sunday,late evening (21-midnight),Between 6 and 9  hours,2019-03-24 21:10:00,2019-03-25 06:02:00,8.866666666666667,2019-03-24
480,UT9,Share-14,Shared,Shared-12,24.03.2019 22:30,22,25.03.2019 09:13,9,17.28,10.70666667,Mar,Sunday,late evening (21-midnight),Between 9 and 12 hours,2019-03-24 22:30:00,2019-03-25 09:13:00,10.716666666666667,2019-03-24
481,Bl2,Bl2-4,Private,Private,25.03.2019 02:16,2,25.03.2019 12:11,12,12.95,9.906666667,Mar,Monday,early night (midnight-3),Between 9 and 12 hours,2019-03-25 02:16:00,2019-03-25 12:11:00,9.916666666666666,2019-03-25
482,Bl2,Share-8,Shared,Shared-6,25.03.2019 11:37,11,25.03.2019 16:08,16,21.14,4.5175,Mar,Monday,late morning (9-12),Between 3 and 6 hours,2019-03-25 11:37:00,2019-03-25 16:08:00,4.516666666666667,2019-03-25
483,Bl2,Bl2-5,Private,Private,25.03.2019 16:02,16,25.03.2019 20:17,20,5.61,4.258611111,Mar,Monday,late afternoon (15-18),Between 3 and 6 hours,2019-03-25 16:02:00,2019-03-25 20:17:00,4.25,2019-03-25
484,AdO1,AdO1-3,Private,Private,25.03.2019 16:41,16,26.03.2019 14:41,14,17.53,22.00972222,Mar,Monday,late afternoon (15-18),More than 18 hours,2019-03-25 16:41:00,2019-03-26 14:41:00,22.0,2019-03-25
485,AsO2,AsO2-1,Private,Private,25.03.2019 18:16,18,26.03.2019 07:07,7,14.56,12.84194444,Mar,Monday,early evening (18-21),Between 12 and 15 hours,2019-03-25 18:16:00,2019-03-26 07:07:00,12.85,2019-03-25
486,Bl2,Bl2-5,Private,Private,25.03.2019 20:59,20,25.03.2019 21:37,21,2.24,0.631666667,Mar,Monday,early evening (18-21),Less than 3 hours,2019-03-25 20:59:00,2019-03-25 21:37:00,0.6333333333333333,2019-03-25
